,tender_id,customer,location,name_of_work,publish_date,submission_date,emd,pbm,e_value,inserted_time,inserted_user_id
0,2025_MKVVC_401478_1,Madhya Pradesh Madhya Kshetra Vidyut Vitaran Company Limited||MPMKVVCL - Regional Office Gwalior||MPMKVVCL - Ashoknagar,OFFICE OF THE GM ONM MPMKVVCL ASHOKNAGAR,Rate Contract For Supply Installation of peripherals for Computer Printer CCTV and Networking equipments Repairing of computers printers CCTV and toner refilling in various type of printers,2025-02-08 10:00,2025-02-17 14:00,16000,,800000,09-02-2025 14:05:20,Mptenders GOV BOT
1,2025_MKVVC_397181_1,Madhya Pradesh Madhya Kshetra Vidyut Vitaran Company Limited||MPMKVVCL - Regional Office Gwalior||MPMKVVCL - Guna,Guna,"Rate Contract For Supply and Installation of peripherals for Computer, Printer, CCTV and Networking equipments, Repairing of computers and printers, CCTV and toner refilling in various type of printers for Offices Situated under MPMKVVCL GUNA.",2025-02-07 18:00,2025-02-20 14:00,30000,,NA,09-02-2025 14:06:32,Mptenders GOV BOT
2,2025_DHS_398246_1,Directorate of Health Services||CS District Datia,District Hospital Datia,CCTV and COMPUTER Repairing and Accessorie,2025-02-07 17:00,2025-02-24 17:30,10000,2025-02-10 10:30,NA,09-02-2025 14:06:49,Mptenders GOV BOT
3,2025_UAD_401126_1,Directorate Urban Administration and Development||Join Director-Bhopal Division - UAD||Rajgarh-Nagar Parishad Pachore - UAD,PACHORE,"Pachore town CCTV based surveillance AND Smart city Framework CCTV,PA SYSTEM AND OUTDOOR LED INSTALLATION",2025-02-06 17:30,2025-02-21 17:30,57750,,7700000,09-02-2025 14:07:07,Mptenders GOV BOT
4,2025_HED_400168_1,Department of Higher Education||Bhopal - Institute for Excellence in Higher Educaiton Bhopal,BHOPAL,IEHE invites online tender for CCTV for Library,2025-02-01 17:30,2025-02-22 17:30,7200,,NA,09-02-2025 14:07:25,Mptenders GOV BOT
5,2025_STDC_398915_1,MP State Tourism Development Corporation Ltd.,work,"External Electrification, CCTV, Fire Alarm and Audio/Video Work at Kalagram Bharat Bhawan Complex, Bhopal",2025-01-31 12:00,2025-02-18 17:00,117930,,11793000,09-02-2025 14:07:42,Mptenders GOV BOT
6,2025_HED_398091_1,Department of Higher Education||Khandwa - Govt Shri Nilkantheshwar P G College Khandwa,"PMCOE Shri Neelkantheshwar Govt PG College,",CCTV Surveillance System,2025-01-25 17:30,2025-02-15 17:30,70000,,NA,09-02-2025 14:08:00,Mptenders GOV BOT
7,2025_HED_397698_1,Department of Higher Education||Bhopal- Govt. Dr.Shyama Prasad Mukherjee Science Commerce College Bhopal,Bhopal,32 CH NVR CCTV Camera POE LED TV,2025-01-22 15:00,2025-02-12 14:00,12000,2025-01-29 12:00,1200000,09-02-2025 14:08:17,Mptenders GOV BOT
8,2024_SEDC_391925_1,Madhya Pradesh State Electronics Development Corporation Ltd.||PERSONNEL AND ADMINISTRATION - MPSEDC,MPSEDC Bhopal,"Selection of System Integrator for SMART CCTV Surveillance System, MPSEDC, Madhya Pradesh",2025-01-01 10:00,2025-02-13 15:00,270000,2025-01-07 15:00,NA,09-02-2025 14:08:35,Mptenders GOV BOT
