,tender_id,customer,location,name_of_work,publish_date,submission_date,emd,pbm,e_value,inserted_time,inserted_user_id
0,2025_MEDIC_447110_1,Medical and Health||Chief Engineer,Hanumangarh,Electrification work at SHC Dabli Kalan Distt. Hanumangarh S No. 15,2025-02-11 11:00,2025-02-13 18:00,8000,,400000,11-02-2025 11:57:33,Eproc Rajasthan GOV BOT
1,2025_JDAJO_446383_1,Jodhpur Development Authority,jda jodhpur,"Laying of sewerage line and C.C. road construction work from lane no.-10 of ward no.-27 of Nagar Nigam South to railway track, Baldev Nagar, Electrical Board and Shiv Basti to Jabreshvar Mahadev temple.",2025-02-10 09:30,2025-02-20 18:00,266000,,13300000,11-02-2025 11:59:40,Eproc Rajasthan GOV BOT
2,2025_CEPWD_443591_6,PWD - CE AND AS||ACE - KOTA||SE-KOTA||EE-DIST-KOTA,JHALAWAR,Widening and Strengthening Gelani on MDR-179 to Hemra via Raipur Jhoomki Teetarwasa Rundlao Undal via Deori Khanpuriya Kalmandi Kalan Salotiya Kishanpuriya Radi Ke Balaji Jhalawar NH 52 from Km.49/100 to 73/800 88/800 to 101/100 (MDR379),2025-01-25 09:00,2025-02-24 18:00,5486000,2025-01-30 11:00,548600000,11-02-2025 12:04:39,Eproc Rajasthan GOV BOT
3,2024_DLB_437929_5,DLB,Jodhpur Division,"Design, Construction, Establishment of Regional Landfill sites for various ULBs under Package_05 (4 Cluster SLF) including O and M for 5 years on VGF basis as per SWM Rules 2016 amended time to time and SBM(U)2.0 guidelines for 22 ULBs Jodhpur Div",2024-12-17 16:15,2025-02-17 14:00,5400380,2025-01-07 15:00,270019000,11-02-2025 12:10:35,Eproc Rajasthan GOV BOT
4,2024_RUDSI_432786_2,Rajasthan Urban Drinking Water Sewerage and Infrastructure Corp. Ltd. (RUDSICO),RUDSICO,Formulation of GIS-based Master Plan for Towns under AMRUT 2.0 (Package 02),2024-11-26 17:00,2025-02-14 15:00,796000,2024-12-02 15:00,39800000,11-02-2025 12:14:41,Eproc Rajasthan GOV BOT
