,tender_id,customer,location,name_of_work,publish_date,submission_date,emd,pbm,e_value,inserted_time,inserted_user_id
0,2024_EB_510266_2,TNEB Limited||TANGEDCO||CE-Distribution-Vellore - TANGEDCO||SE-Krishnagiri - TANGEDCO,Krishnagiri,11KV Fixed and Moving Contact for AB Switch,2024-12-12 14:00,2024-12-26 14:00,10000,,NA,15-12-2024 13:11:27,Tntenders GOV NIC BOT
1,2024_EB_509579_1,TNEB Limited||TANGEDCO||CE-TTPS - TANGEDCO||SE-Purchase and Administration-TTPS - TANGEDCO,TTPS,"Supply of 125 KVA, 3 Phase Diesel Generator set and Change over Switch outdoor type panel",2024-12-10 18:00,2024-12-26 14:00,19100,,NA,15-12-2024 13:12:03,Tntenders GOV NIC BOT
2,2024_EB_509439_1,TNEB Limited||TANGEDCO||CE-NCTPS-II - TANGEDCO||SE-Purchase and Administration-NCTPS-II - TANGEDCO,NCTPS-II,Supply of Lube oil flow switches cum Indicator,2024-12-10 14:00,2024-12-26 14:00,8900,,NA,15-12-2024 13:12:24,Tntenders GOV NIC BOT
3,2024_EB_509096_1,TNEB Limited||TANGEDCO||CE-TTPS - TANGEDCO||SE-Civil-TTPS - TANGEDCO,TTPS,Dismantling the damaged RCC Culvert and Providing New RCC Culvert in West side of Switchyard 2 building in Unit 4 and 5,2024-12-09 18:00,2024-12-26 14:00,4700,,NA,15-12-2024 13:12:42,Tntenders GOV NIC BOT
4,2024_EB_509096_1,TNEB Limited||TANGEDCO||CE-TTPS - TANGEDCO||SE-Civil-TTPS - TANGEDCO,TTPS,Dismantling the damaged RCC Culvert and Providing New RCC Culvert in West side of Switchyard 2 building in Unit 4 and 5,2024-12-09 18:00,2024-12-26 14:00,4700,,NA,15-12-2024 13:13:00,Tntenders GOV NIC BOT
