,tender_id,customer,location,name_of_work,publish_date,submission_date,emd,pbm,e_value,inserted_time,inserted_user_id
0,2025_SBSTC_820647_1,SOUTH BENGAL STATE TRANSPORT CORPORATION,DURGAPUR/KALIPAHARI,Installation of CC TV Camera at ISBT (Inter State Bus Terminus) at Kalipahari Asansol,2025-02-26 15:00,2025-03-12 15:00,4510,2025-02-28 15:00,225500,28-02-2025 19:32:40,WBtenders GOV NICGEP BOT
1,2025_DCSWB_819118_1,DIRECTORATE OF CORRECTIONAL SERVICES WB,Correctional Homes of WB,Procurement of BODY WORN CAMERA (WITHOUT SIM),2025-02-25 15:00,2025-03-12 17:30,100000,2025-03-06 15:00,NA,28-02-2025 19:33:19,WBtenders GOV NICGEP BOT
2,2025_DCSWB_819118_1,DIRECTORATE OF CORRECTIONAL SERVICES WB,Correctional Homes of WB,Procurement of BODY WORN CAMERA (WITHOUT SIM),2025-02-25 15:00,2025-03-12 17:30,100000,2025-03-06 15:00,NA,28-02-2025 19:33:37,WBtenders GOV NICGEP BOT
3,2025_WBPWD_817605_2,PUBLIC WORKS DEPARTMENT||P.W. DIRECTORATE||PWD (SOUTH ZONE)||BIDHANNAGAR CIRCLE||BIDHANNAGAR WEST DIVISION||BIDHANNAGAR WEST SUB DIVISION-II,"Salt Lake, Kolkata","Provision of new railing in front of camera platform and repairing damage fencing at Vivekananda Yuba Bharati Krirangan salt lake, during the year 2024-25",2025-02-19 18:55,2025-03-01 13:00,9609,,480438,28-02-2025 19:34:05,WBtenders GOV NICGEP BOT
4,2025_WBPDC_816173_1,THE WEST BENGAL POWER DEVELOPMENT CORPORATION LTD.||KOLAGHAT THERMAL POWER STATION (KTPS),Kolaghat Thermal Power Station,"Supply, installation, commissioning and integration of CCTV Camera for KTPS Township under CAPEX 2021-22",2025-02-19 10:00,2025-03-26 15:00,338300,2025-03-05 17:30,NA,28-02-2025 19:34:23,WBtenders GOV NICGEP BOT
