tender_id,name_of_work,customer,inserted_time,inserted_user_id,verification_1,done
2024_PWDJK_243329_1,REPAIR AND RENOVATION WORKS OF ABHINAV THEATRE J and K ART CULTURE AND LANGUAGES ACADEMY JAMMU,PWD||CE RandB Jammu||SE RandB North Jammu||EE RandB Bakshi Nagar,21-01-2024 06:02:43,J&KTenders GOV NICGEP BOT,rejected,
2024_PWDJK_243432_1,Construction of 150 Mtr Span Double lane RCC Motorable bridge with 1 2 mtr wide Footpath on bothsides over Mandi Nallah at Sathra Tehsil Mandi District Poonch Under NABARD RIDF XXIX,PWD||CE RandB Pir Panjal,23-01-2024 06:00:25,J&KTenders GOV NICGEP BOT,rejected,
2024_PWDJK_243449_2,Construction of lane/stair steps from Main road to H/O Mohd Ashraf Wani,PWD||CE PWD Kashmir||Srinagar Badgam Circle||Budgam Division,24-01-2024 06:08:23,J&KTenders GOV NICGEP BOT,rejected,
2024_PWDJK_243449_3,Construction of Lane from Main road to H/O Fayaz Ahmad Shah via Masjid Abu Baker Khansahib,PWD||CE PWD Kashmir||Srinagar Badgam Circle||Budgam Division,26-01-2024 06:24:45,J&KTenders GOV NICGEP BOT,rejected,
2024_PWDJK_243470_1,Construction of Lane from Link road to H/o Abdul Gani Dar at Ward No.11,PWD||Chief Engineer Central Kashmir||Budgam Circle||Beerwah Division,26-01-2024 06:26:23,J&KTenders GOV NICGEP BOT,rejected,
2024_PWDJK_243470_2,Construction of tiled lane from main road to H/o Mohd Ashraf Dar via H/o Bashir Ahmad Dar at Ward No.2 under IDMT 2023-24,PWD||Chief Engineer Central Kashmir||Budgam Circle||Beerwah Division,24-01-2024 06:11:39,J&KTenders GOV NICGEP BOT,rejected,
2024_PWDJK_243507_1,Preparation of DPR Site plan conducting of detailed survey Rendering of service for Providing of Architectural structural design of RCC as per Indian Standard codes of practice and service including BOQ supporting with detailed estimate for 1 Const,PWD||CE PWD Jammu||Rajouri Circle||Rajouri Division,26-01-2024 06:17:58,J&KTenders GOV NICGEP BOT,rejected,
2024_PWDJK_243507_2,Preparation of DPR Site plan conducting of detailed survey Rendering of service for Providing of Architectural structural design of RCC as per Indian Standard codes of practice and service including BOQ supporting with detailed estimate for 2 Const,PWD||CE PWD Jammu||Rajouri Circle||Rajouri Division,26-01-2024 06:16:38,J&KTenders GOV NICGEP BOT,rejected,
2024_PWDJK_243507_3,Preparation of DPR Site plan conducting of detailed survey Rendering of service for Providing of Architectural structural design of RCC as per Indian Standard codes of practice and service including BOQ supporting with detailed estimate for 3 Const,PWD||CE PWD Jammu||Rajouri Circle||Rajouri Division,26-01-2024 06:16:20,J&KTenders GOV NICGEP BOT,rejected,
2024_PWDJK_243507_4,Preparation of DPR Site plan conducting of detailed survey Rendering of service for Providing of Architectural structural design of RCC as per Indian Standard codes of practice and service including BOQ supporting with detailed estimate for 4 Const,PWD||CE PWD Jammu||Rajouri Circle||Rajouri Division,27-01-2024 06:10:53,J&KTenders GOV NICGEP BOT,rejected,
2024_PWDJK_243507_5,Preparation of DPR Site plan conducting of detailed survey Rendering of service for Providing of Architectural structural design of RCC as per Indian Standard codes of practice and service including BOQ supporting with detailed estimate for 5 Const,PWD||CE PWD Jammu||Rajouri Circle||Rajouri Division,27-01-2024 06:10:00,J&KTenders GOV NICGEP BOT,rejected,
2024_PWDJK_243509_2,Design and Construction of 1x20 mtr intermediate lane composite girder bridge at Kudara Poswal Basti at Bandipora on EPC MODE,PWD||CE PWD Kashmir||Ganderbal Bandipora Circle||Bandipora Spl. Sub. Division,27-01-2024 06:12:57,J&KTenders GOV NICGEP BOT,rejected,
2024_PWDJK_243523_1,Repair of lane Drain including tile work at ward no 05 MC Rajouri,PWD||CE PWD Jammu||Rajouri Circle||Rajouri Division,26-01-2024 06:19:39,J&KTenders GOV NICGEP BOT,rejected,
2024_PWDJK_243523_5,Balance work for construction of Lane Drain in Ward No 16 Rajouri,PWD||CE PWD Jammu||Rajouri Circle||Rajouri Division,26-01-2024 06:19:20,J&KTenders GOV NICGEP BOT,rejected,
2024_PWDJK_243563_1,"Construction of 1.Lane/drain with interlock tiles from main road to H/O Th.Rajinder Singh in Ward No-04 2.Construction of Lane/drain with interlock tiles from shop of Ashok Kumar to H/O Kewal Krishan W.No-08, 3.Construction of slab pully over the na",PWD||CE RandB Pir Panjal||SE RandB Poonch,26-01-2024 06:12:26,J&KTenders GOV NICGEP BOT,rejected,
2024_PWDJK_243563_2,Construction of link road Moh Bajjran Lower Kunyian UNDER DISTRICT PLAN DDC Plan.3rd Call,PWD||CE RandB Pir Panjal||SE RandB Poonch,27-01-2024 06:07:24,J&KTenders GOV NICGEP BOT,rejected,
2024_PWDJK_243587_3,Construction of drain near H/o Foja Singh Lane No. 04 Sector 03 Govind Nagar camp road Jammu(2nd call),PWD||CE RandB Jammu||SE RandB South Jammu||EE RandB Satwari,26-01-2024 06:12:44,J&KTenders GOV NICGEP BOT,rejected,
2024_PWDJK_243608_1,"Annual Maintenance Contract of Cameras installed at Chief Secretary Meeting Hall and Chamber, 1st Floor meeting Hall, Honble LG Conference Hall, Audio System Meeting Hall of 2nd Floor at Civil Secretariat Jammu. CNO 288.",PWD||CE RandB Jammu||SE RandB South Jammu||EE RandB PD 3rd,26-01-2024 06:00:09,J&KTenders GOV NICGEP BOT,rejected,
2024_PWDJK_243626_1,Construction of 1x15mtr. Span Foot Bridge over Nallah Gohallan at Jabla Sukhdar,PWD||CE PWD Kashmir||Baramulla Kupwara Circle||Uri Spl. Sub. Division,26-01-2024 06:08:13,J&KTenders GOV NICGEP BOT,rejected,
2024_PWDJK_243643_2,onstruction of Tile lane from house of Mohd Yousuf shah to house of Nizam ud din shah Peer mohalla ward-B at MC Pulwama,PWD||Chief Engineer South Kashmir||Pulwama-Shopian Circle||Pulwama Division,27-01-2024 06:02:22,J&KTenders GOV NICGEP BOT,rejected,
2024_PWDJK_243686_3,Construction of Secondary Library Room at Govt. HS Landoora Shopian,PWD||Chief Engineer South Kashmir||Pulwama-Shopian Circle||Zainpora Division,26-01-2024 06:05:37,J&KTenders GOV NICGEP BOT,rejected,
2024_PWDJK_243704_1,Revamping Repairs/ Renovation of internal electrification with controlling and protection switch gear devices with fixtures and LAN networking of District fund office Srinagar.,PWD||Chief Engineer Central Kashmir||Srinagar South Circle,26-01-2024 06:03:26,J&KTenders GOV NICGEP BOT,rejected,
2024_PWDJK_243715_1,"Providing and Installation of Boom Barrier System Integrated with ANPR Automatic Number Plate Recognition LPR License Plate Recognition Cameras along with other allied works on turnkey basis at Fruit and Vegetable Market, Narwal, Jammu",PWD||CE MED Jammu||Mechanical Circle Jammu||Jammu Division,27-01-2024 06:00:08,J&KTenders GOV NICGEP BOT,rejected,
2024_PWDJK_243731_4,Construction of protection bund near land of Gh Nabi and parvaiz Ahmad Manzhar to Mirnag road,PWD||CE PWD Kashmir||Baramulla Kupwara Circle||Kupwara Division,27-01-2024 06:00:58,J&KTenders GOV NICGEP BOT,rejected,
2024_PWRDW_35522_13,CE/EAP/ARRBP/OCB/Bridges-2/Golaghat/03 Construction of Bridges in Golaghat district i.Br. No.1/1 Garhgaon Langthajan Road ii.Br. No. 2/2 Uriumghat Rajapukhuri Road,Public Works Roads Department-Externally Aided Project||Public Works Road Department- World Bank Funded Tenders||Assam State Bridge Infrastructure Program,20-01-2024 02:31:04,Assam GOV NICGEP BOT,rejected,
2024_RDD_12401_1,Construction of Dry Stone Riser Wall near the land of Ahmad Ali and Others at Mohallah Archo Choskore under CCDA,Rural Development and Panchayati Raj||Directorate of RDD||Command Area Development Kargil,24-01-2024 06:30:25,LEHTenders GOV NICGEP BOT,rejected,
2024_RDPR_242957_21,Construction of land leveling Badi dabed near the land of Gushi ram W. no. 6in PytDevigarh Block Bhomag Distt. Reasi under NRM PMKSY 2.0 (IWMP) for the year 2023-24,Rural Development and Panchayati Raj||Directorate of Rural Development Department JAMMU||Superintending Engineer REW Jammu||XEN REW REASI,20-01-2024 06:19:29,J&KTenders GOV NICGEP BOT,rejected,
2024_RDPR_243133_2,"Constt of lane, drain at village Panjtoot moh school Panchyat Panjtoot Block Samwan.",Rural Development and Panchayati Raj||Directorate of Rural Development Department JAMMU||Superintending Engineer REW Jammu||XEN REW JAMMU,20-01-2024 06:11:54,J&KTenders GOV NICGEP BOT,rejected,
2024_RDPR_243239_2,Tile work for lane in pyt rakhlachipur wno 2,Rural Development and Panchayati Raj||Directorate of Rural Development Department JAMMU||Superintending Engineer REW Jammu||XEN REW KATHUA,20-01-2024 06:03:14,J&KTenders GOV NICGEP BOT,rejected,
2024_RDPR_243265_1,CONSTT. OF LANE AND FIXING OF TILES MOHALLA LABHA RAM GANDHI VILLAGE NANDPUR PYT CHAK NAZIR Block Ramgarh under the scheme MPLAD for the Year 2023-24,Rural Development and Panchayati Raj||Directorate of Rural Development Department JAMMU||Superintending Engineer REW Jammu||XEN REW SAMBA,20-01-2024 06:06:53,J&KTenders GOV NICGEP BOT,rejected,
2024_RDPR_243270_10,DEVELOPMENT OF LANE IN GOVT PRY SCHOOL NAGNARD ARIPAL,Rural Development and Panchayati Raj||RURAL DEVELOPMENT DEPARTMENT KASHMIR||Superintending Engineer REW Kashmir||XEN REW Pulwama,22-01-2024 06:02:36,J&KTenders GOV NICGEP BOT,rejected,
2024_RDPR_243270_12,DEVELOPMENT OF LANE H/O ABDUL GANI KHAN TOWADS TANTRAY MOHALLA AT ARIPAL,Rural Development and Panchayati Raj||RURAL DEVELOPMENT DEPARTMENT KASHMIR||Superintending Engineer REW Kashmir||XEN REW Pulwama,20-01-2024 06:00:58,J&KTenders GOV NICGEP BOT,rejected,
2024_RDPR_243270_7,Construction of Lane by way of RCC Slab from Main Road to H/O Mahmood Dar at Wagad,Rural Development and Panchayati Raj||RURAL DEVELOPMENT DEPARTMENT KASHMIR||Superintending Engineer REW Kashmir||XEN REW Pulwama,23-01-2024 06:03:23,J&KTenders GOV NICGEP BOT,rejected,
2024_RDPR_243270_9,CONSTRUCTION OF LANE FROM H/O RAFIQ AHMAD SOFI TO H/O MOHD YOUNIS DAR AT SATOORA,Rural Development and Panchayati Raj||RURAL DEVELOPMENT DEPARTMENT KASHMIR||Superintending Engineer REW Kashmir||XEN REW Pulwama,20-01-2024 06:01:44,J&KTenders GOV NICGEP BOT,rejected,
2024_RDPR_243327_14,Construction of RCC Bunkers (individual bunker) Chander Bhag s/o Puran singh at Abtal Katlan Block Samba for the Year 2023-24 (6th call).,Rural Development and Panchayati Raj||Directorate of Rural Development Department JAMMU||Superintending Engineer REW Jammu||XEN REW SAMBA,21-01-2024 06:00:56,J&KTenders GOV NICGEP BOT,rejected,
2024_RDPR_243327_15,Construction of RCC Bunkers (individual bunker) Dharam Paul s/o Shiv ram at Abtal Katlan Block Samba for the Year 2023-24 (6th call).,Rural Development and Panchayati Raj||Directorate of Rural Development Department JAMMU||Superintending Engineer REW Jammu||XEN REW SAMBA,23-01-2024 06:02:21,J&KTenders GOV NICGEP BOT,rejected,
2024_RDPR_243441_6,Constt. Of Community Bunker State land village Glar Block Samba District Samba under Year 2023-24,Rural Development and Panchayati Raj||Directorate of Rural Development Department JAMMU||Superintending Engineer REW Jammu||XEN REW SAMBA,24-01-2024 06:13:03,J&KTenders GOV NICGEP BOT,rejected,
2024_RDPR_243447_2,CONSTRUCTION OF LANE FROM NAZIR AHMAD MIR TO LO ALI MOHD AT AVENDGUND,Rural Development and Panchayati Raj||RURAL DEVELOPMENT DEPARTMENT KASHMIR||Superintending Engineer REW Kashmir||XEN REW Pulwama,26-01-2024 06:23:18,J&KTenders GOV NICGEP BOT,rejected,
2024_RDPR_243486_4,c/o culvert with approach lane near preposed panchayat ghar site at monghama,Rural Development and Panchayati Raj||RURAL DEVELOPMENT DEPARTMENT KASHMIR||Superintending Engineer REW Kashmir||XEN REW Pulwama,27-01-2024 06:12:38,J&KTenders GOV NICGEP BOT,rejected,
2024_RDPR_243486_6,REPAIREMENT OF LANE FROM RAJPORA ROAD TO H/O RASOOL YATOO WITH S PIT AT MIDOORA A,Rural Development and Panchayati Raj||RURAL DEVELOPMENT DEPARTMENT KASHMIR||Superintending Engineer REW Kashmir||XEN REW Pulwama,24-01-2024 06:00:50,J&KTenders GOV NICGEP BOT,rejected,
2024_RDPR_243549_1,C/O Levelling of play ground (stat land ) at jabda ward 4 near the h/o Ab Zahid and Razaq (DDC paranpillan) Block Paranpila,Rural Development and Panchayati Raj||RURAL DEVELOPMENT DEPARTMENT KASHMIR||Superintending Engineer REW Kashmir||XEN REW Baramulla,27-01-2024 06:09:23,J&KTenders GOV NICGEP BOT,rejected,
2024_RDPR_243577_9,C/O of Community Modified Leach pit near Panchayat Ghar Heer Halqa Heer under SBM Plan year 2023_24 Block Tangmarg,Rural Development and Panchayati Raj||RURAL DEVELOPMENT DEPARTMENT KASHMIR||Superintending Engineer REW Kashmir||XEN REW Baramulla,26-01-2024 06:13:46,J&KTenders GOV NICGEP BOT,rejected,
2024_RDPR_243579_9,Construction of Community Sanitary Complex (CSC) near shamshan Ghat at village Gho Rakhwalan w.no 04 Pyt Raika labana Block Ramgarh District Samba under the scheme SBM-G II for the Year 2023-24 (Ist Call),Rural Development and Panchayati Raj||Directorate of Rural Development Department JAMMU||Superintending Engineer REW Jammu||XEN REW SAMBA,27-01-2024 06:04:48,J&KTenders GOV NICGEP BOT,rejected,
2024_RDPR_243652_1,C/O LANE FROM MAIN ROAD TO H/O GULAM QADIR LINE AND OTHERS AT RAHMOO A,Rural Development and Panchayati Raj||RURAL DEVELOPMENT DEPARTMENT KASHMIR||Superintending Engineer REW Kashmir||XEN REW Pulwama,26-01-2024 06:04:43,J&KTenders GOV NICGEP BOT,rejected,
2024_RDPR_243652_2,C/O LANE FROM MAIN ROAD TO H/O LATE MOHD AKRAM WANI AND OTHERS AT RAHMOO A,Rural Development and Panchayati Raj||RURAL DEVELOPMENT DEPARTMENT KASHMIR||Superintending Engineer REW Kashmir||XEN REW Pulwama,27-01-2024 06:02:40,J&KTenders GOV NICGEP BOT,rejected,
2024_RDPR_243652_4,C/O LANE WITH P BUND FROM SHOP OF MOHD YOUSUF WANI TO H/O KHURSHID AHMAD WANI AND OTHERS AT RAHMOO B,Rural Development and Panchayati Raj||RURAL DEVELOPMENT DEPARTMENT KASHMIR||Superintending Engineer REW Kashmir||XEN REW Pulwama,26-01-2024 06:03:53,J&KTenders GOV NICGEP BOT,rejected,
2024_RDPR_243652_5,C/O LANE FROM LINK ROAD TO H/O MOHD ASHRAF GANAI AND TO H/O BASHIR AHMAD GANAI TO MASHJID SHARIEF AT KAMRAZIPORA,Rural Development and Panchayati Raj||RURAL DEVELOPMENT DEPARTMENT KASHMIR||Superintending Engineer REW Kashmir||XEN REW Pulwama,26-01-2024 06:01:50,J&KTenders GOV NICGEP BOT,rejected,
2024_RDPR_243664_1,Constt. of Lane/Drain near h/o Joginder singh w.no 06 Pyt. Raipur Lower Domana Block Bhalwal under UT Capex Budget CD and Pyt 2023-24.,Rural Development and Panchayati Raj||Directorate of Rural Development Department JAMMU||Superintending Engineer REW Jammu||XEN REW JAMMU,26-01-2024 06:06:28,J&KTenders GOV NICGEP BOT,rejected,
2024_RDPR_243664_2,Constt. of Lane/Drain near h/o Ranvijay singh Pyt. Kote Lower Garhi Morh Block Bhalwal under UT Capex Budget CD and Pyt 2023-24,Rural Development and Panchayati Raj||Directorate of Rural Development Department JAMMU||Superintending Engineer REW Jammu||XEN REW JAMMU,26-01-2024 06:07:05,J&KTenders GOV NICGEP BOT,rejected,
2024_RDPR_243671_1,CNSTRUCTION OF LANE WITH DRAIN FROM MAIN ROAD NARBAL TO THE H/O MOHMMAD ASHRIF KHAN S/O WALI MOHAMMAD KHAN AT MUKHDAN MOHALLA NARBAL NARBAL PANCHYAT HALQA HAKRIPORA BLOCK NEWA,Rural Development and Panchayati Raj||RURAL DEVELOPMENT DEPARTMENT KASHMIR||Superintending Engineer REW Kashmir||XEN REW Pulwama,26-01-2024 06:01:29,J&KTenders GOV NICGEP BOT,rejected,
2024_RDSPL_80920_1,"Construction of PCC Road from Rezzaq land to Nagarnabi More, Panchayat- Sitapahari Block- Pakur, District- Pakur",RDD Special Division||RDD SPL CE RANCHI||RDD SPL SE Dumka||RDD SPL EE Pakur,22-01-2024 06:15:22,JKDTenders GOV NICGEP BOT,rejected,
2024_RDTN_406172_2,Providing CC Road to and Drain and to Karikalan Street in Mannivakkam Panchayat at Kattankolathur Panchayat Union,"Rural Development and Panchayat Raj Department||Kancheepuram,RD,TN||KATTANKULATHUR, KANCHEEPURAM,RD,TN",20-01-2024 08:44:18,Tntenders GOV NIC BOT,rejected,
2024_RDTN_409248_15,"Tirunelveli District - Improvement to Roads, Streets and Lanes in Peri urban Village Panchayats under I and A and LPA Funds 2023-24 in Package No.15/I and A/ 2023-24","Rural Development and Panchayat Raj Department||Tirunelveli,RD,TN",21-01-2024 08:54:57,Tntenders GOV NIC BOT,rejected,
2024_RDTN_409248_25,"Tirunelveli District - Improvement to Roads, Streets and Lanes in Peri urban Village Panchayats under I and A and LPA Funds 2023-24 in Package No.25/LPA/ 2023-24","Rural Development and Panchayat Raj Department||Tirunelveli,RD,TN",20-01-2024 08:51:50,Tntenders GOV NIC BOT,rejected,
2024_RDTN_410190_1,"Madurai District_ Improvement to Roads, Steets 6 Nos and Lanes in Othakadai village panchayat in Madurai East Union under I and AF Funds (2023-24) Package no 05","Rural Development and Panchayat Raj Department||Madurai,RD,TN",24-01-2024 08:46:17,Tntenders GOV NIC BOT,rejected,
2024_RDTN_410191_1,"Madurai District_ Improvement to Roads, Steets 5Nos and Lanes in Othakadai village panchayat in Madurai East Union under I and AF Funds (2023-24) Package no 06","Rural Development and Panchayat Raj Department||Madurai,RD,TN",24-01-2024 09:03:24,Tntenders GOV NIC BOT,rejected,
2024_RDTN_410223_1,"Madurai District_ Improvement to Roads, Steets 4 Nos and Lanes in Othakadai village panchayat in Madurai East Union under I and AF Funds (2023-24) Package no1","Rural Development and Panchayat Raj Department||Madurai,RD,TN",24-01-2024 09:05:46,Tntenders GOV NIC BOT,rejected,
2024_RDTN_410225_1,"Madurai District_ Improvement to Roads, Steets 4 Nos and Lanes in Othakadai village panchayat in Madurai East Union under I and AF Funds (2023-24) Package no 02","Rural Development and Panchayat Raj Department||Madurai,RD,TN",24-01-2024 09:06:33,Tntenders GOV NIC BOT,rejected,
2024_RDTN_410226_1,"Madurai District_ Improvement to Roads, Steets 4 Nos and Lanes in Othakadai village panchayat in Madurai East Union under I and AF Funds (2023-24) Package no 03","Rural Development and Panchayat Raj Department||Madurai,RD,TN",24-01-2024 09:06:15,Tntenders GOV NIC BOT,rejected,
2024_RDTN_410229_1,"Madurai District_ Improvement to Roads, Steets 3 Nos and Lanes in Othakadai village panchayat in Madurai East Union under I and AF Funds (2023-24) Package no 04","Rural Development and Panchayat Raj Department||Madurai,RD,TN",24-01-2024 08:41:02,Tntenders GOV NIC BOT,rejected,
2024_RDTN_410948_7,Providing Horizontal soak pit at Veeramani Nagar Center of Agri Land and Canal in Kalappakulam Village Panchayat in Sankarankovil Panchayat Union,"Rural Development and Panchayat Raj Department||Tirunelveli,RD,TN||SANKARANKOIL, TIRUNELVELI,RD,TN",20-01-2024 08:42:50,Tntenders GOV NIC BOT,rejected,
2024_RDTN_411363_1,Thoothukudi District-Tiruchendur Panchayat Union -Peri Urban Villages- IAF - Improvements to 15 No of Streets and Lanes at Veerapandianpattinam Panchayat Package No TN/TUT-02/2023-24 IAF,"Rural Development and Panchayat Raj Department||Thoothukudi,RD,TN",21-01-2024 08:42:33,Tntenders GOV NIC BOT,rejected,
2024_RDTN_411363_10,Thoothukudi District-Thoothukudi Panchayat Union -Peri Urban Villages- LPA - Improvements to 12 No of Streets and Lanes at Mappillaiyurani Panchayat Package No TN/TUT-04/2023-24 LPA,"Rural Development and Panchayat Raj Department||Thoothukudi,RD,TN",24-01-2024 09:12:32,Tntenders GOV NIC BOT,rejected,
2024_RDTN_411363_11,Thoothukudi District-Thoothukudi Panchayat Union -Peri Urban Villages- LPA - Improvements to 16 No of Streets and Lanes at Mappillaiyurani Panchayat Package No TN/TUT-05/2023-24 LPA,"Rural Development and Panchayat Raj Department||Thoothukudi,RD,TN",23-01-2024 08:44:34,Tntenders GOV NIC BOT,rejected,
2024_RDTN_411363_12,Thoothukudi District-Thoothukudi Panchayat Union -Peri Urban Villages- LPA - Improvements to 10 No of Streets and Lanes at Mappillaiyurani Panchayat Package No TN/TUT-06/2023-24 LPA,"Rural Development and Panchayat Raj Department||Thoothukudi,RD,TN",24-01-2024 09:13:25,Tntenders GOV NIC BOT,rejected,
2024_RDTN_411363_14,Thoothukudi District-Thoothukudi Panchayat Union -Peri Urban Villages- LPA - Improvements to 19 No of Streets and Lanes at Mappillaiyurani Panchayat Package No TN/TUT-08/2023-24 LPA,"Rural Development and Panchayat Raj Department||Thoothukudi,RD,TN",23-01-2024 08:43:39,Tntenders GOV NIC BOT,rejected,
2024_RDTN_411363_2,Thoothukudi District-Tiruchendur Panchayat Union -Peri Urban Villages- IAF - Improvements to 15 No of Streets and Lanes at Veerapandianpattinam Panchayat Package No TN/TUT-03/2023-24 IAF,"Rural Development and Panchayat Raj Department||Thoothukudi,RD,TN",21-01-2024 08:42:02,Tntenders GOV NIC BOT,rejected,
2024_RDTN_411363_5,Thoothukudi District-Kovilpatti Panchayat Union -Peri Urban Villages- IAF - Providing Paver Block Arrangements to 6 No of Streets and Lanes at Illupaiyurani Panchayat Package No TN/TUT-05/2023-24 IAF,"Rural Development and Panchayat Raj Department||Thoothukudi,RD,TN",23-01-2024 08:44:53,Tntenders GOV NIC BOT,rejected,
2024_RDTN_411363_6,"Thoothukudi District-Kovilpatti Panchayat Union -Peri Urban Villages- IAF - Providing Paver Block Arrangements to 7 No of Streets and Lanes at Inammaniyatchi, Thittankulam, Nalatinpudur Panchayat Package No TN/TUT-06/2023-24 IAF","Rural Development and Panchayat Raj Department||Thoothukudi,RD,TN",23-01-2024 08:47:30,Tntenders GOV NIC BOT,rejected,
2024_RDTN_411363_7,Thoothukudi District-Thoothukudi Panchayat Union -Peri Urban Villages- LPA - Improvements to 13 No of Streets and Lanes at Mappillaiyurani Panchayat Package No TN/TUT-01/2023-24 LPA,"Rural Development and Panchayat Raj Department||Thoothukudi,RD,TN",23-01-2024 08:46:34,Tntenders GOV NIC BOT,rejected,
2024_RDTN_411363_8,Thoothukudi District-Thoothukudi Panchayat Union -Peri Urban Villages- LPA - Improvements to 12 No of Streets and Lanes at Mappillaiyurani Panchayat Package No TN/TUT-02/2023-24 LPA,"Rural Development and Panchayat Raj Department||Thoothukudi,RD,TN",23-01-2024 08:45:49,Tntenders GOV NIC BOT,rejected,
2024_RDTN_411363_9,Thoothukudi District-Thoothukudi Panchayat Union -Peri Urban Villages- LPA - Improvements to 19 No of Streets and Lanes at Mappillaiyurani Panchayat Package No TN/TUT-03/2023-24 LPA,"Rural Development and Panchayat Raj Department||Thoothukudi,RD,TN",24-01-2024 09:13:44,Tntenders GOV NIC BOT,rejected,
2024_RDTN_412013_1,P6/ Construction of New Two Class Room Building in PUPS at L.Karungulam Habitation in Lanthai panchayat / Thiruppullani Block,"Rural Development and Panchayat Raj Department||Ramnad,RD,TN||TIRUPPULLANI, RAMANATHAPURAM,RD,TN",24-01-2024 09:08:48,Tntenders GOV NIC BOT,rejected,
2024_RDTN_412102_1,"Providing and Instalation Of Computer System, Printers, UPS Camera, Mick and Accesorries at Panchayat Union Office","Rural Development and Panchayat Raj Department||Coimbatore,RD,TN||SARKARSAMAKULAM, COIMBATORE,RD,TN",24-01-2024 08:40:09,Tntenders GOV NIC BOT,rejected,
2024_REDUP_883555_27,Ward No.-70 Gayatripuram Colony Nakha No.-01 Lane No.-01/N Colony mein Mukhya Sadak Se Shree Subhash Sharma ke makan se Shree T.N. Pandey ke Makan Tak 141 Metre CC Road avam Nali,Director Cum Chief Engineer RED||CHIEF ENGINEER EAST||SE GORAKHPUR CIRCLE||EE GORAKHPUR,23-01-2024 05:25:35,Etenders UP NIC BOT,rejected,
2024_REDUP_884162_4,"Construction of 90 Meter CC road up to street no. 2 in Ballan Budhan Colony (from main road) in village Maluhi Saraiya, Block- Khairabad",Director Cum Chief Engineer RED||CHIEF ENGINEER EAST||SE LUCKNOW CIRCLE||EE SITAPUR,24-01-2024 09:04:10,Tendersodisha GOV BOT,rejected,
2024_REDUP_884162_5,"Construction of 70 Meter CC road from Main Nepal Singh college to street no. 2 in Ballan Budhan Colony in village Mainasi Saraiya, Block- Khairabad",Director Cum Chief Engineer RED||CHIEF ENGINEER EAST||SE LUCKNOW CIRCLE||EE SITAPUR,24-01-2024 09:03:27,Tendersodisha GOV BOT,rejected,
2024_RRVUN_378437_1,"Comprehensive AMC for HCL / DELL / HP other make PC, Server , Printer, scanner, Network switches and Network installed for local area network (for internet connectivity) at KSTPS Kota","RRVUN - CMD||RVUN - CE - (TH), KSTPS, Kota, Jaipur",26-01-2024 04:01:04,Eproc Rajasthan GOV BOT,rejected,
2024_RVUNL_883926_1,"Work of Routine, preventive and Breakdown Maintenance, repair/ rectification works of Rail Track Private Siding , R.C.C. Rail Track at wagon tippler, worn out damaged points and crossings and switch rails of CHP-A and CHP-B of Obra Thermal Power Pr",UP Rajya Vidyut Utpadan Nigam Ltd||Obra Thermal Power Project- UPRVUNL- Sonebhadra,24-01-2024 06:37:29,Etenders UP NIC BOT,rejected,
2024_RWD_79915_1,Construction of PCC Road from Goshmad Land to Sunil Mal Land (L- 170.00M) Block-Maheshpur,"RWD EinC||RWD CE||RWD SE, DUMKA.||RWD EE, PAKUR.",22-01-2024 06:13:23,JKDTenders GOV NICGEP BOT,rejected,
2024_RWD_79919_1,Construction of PCC Road from Habbu Moral Land to Abdul Hque Land (L- 264.00M) Block-Maheshpur,"RWD EinC||RWD CE||RWD SE, DUMKA.||RWD EE, PAKUR.",21-01-2024 06:13:26,JKDTenders GOV NICGEP BOT,rejected,
2024_RWD_79946_1,Construction of PCC Road from Nunadanga school to Kontol Murmu Land in Boahra Village (L- 320.00M) Block-Maheshpur,"RWD EinC||RWD CE||RWD SE, DUMKA.||RWD EE, PAKUR.",20-01-2024 06:12:34,JKDTenders GOV NICGEP BOT,rejected,
2024_RWD_79957_1,Construction of PCC Road from Mosam Sekh Land to Murgadanga Sosotola (L- 443.00M) Block-Maheshpur,"RWD EinC||RWD CE||RWD SE, DUMKA.||RWD EE, PAKUR.",20-01-2024 06:14:05,JKDTenders GOV NICGEP BOT,rejected,
2024_RWD_79962_1,Construction of PCC Road from Logen Hansda Land to Murgadanga Bridge (L- 345.00M) Block-Maheshpur,"RWD EinC||RWD CE||RWD SE, DUMKA.||RWD EE, PAKUR.",20-01-2024 06:16:25,JKDTenders GOV NICGEP BOT,rejected,
2024_SCIDC_882435_1,PMAGY Gram Sabha Pahadpur urf Langadpur Gram Panchayat Hetimpur Vikas Khand Ghazipur me Dhakandar naali or solar street light ka karyy.,U.P. State Construction and Infrastructure Development Corporation Ltd.||Unit Jaunpur,20-01-2024 06:04:31,Etenders UP NIC BOT,rejected,
2024_SCIDC_885614_1,"VIDHAYAK NIDHI 23-24 KE ANTARGAT BLOCK- JAKHORA KI GRAM PANCHAYAT NOHARKALAN ME BHESASUR DEVTA MANDIR KE PAS SARVAJANIK STHAN PAR TEEN SHED KA NIRMAN KARYA , DIST- LALITPUR",U.P. State Construction and Infrastructure Development Corporation Ltd.||Unit Lalitpur,26-01-2024 05:25:09,Etenders UP NIC BOT,rejected,
