tender_id,name_of_work,customer,inserted_time,inserted_user_id,verification_1,done
GEM_2024_B_4510173,"Video Conferencing,LED Display,USB PTZ based Web Camera,USB Type A based cascaded microphone cum sp",Ministry of Electronics and Information Technology Department of Electronics and Information Technology,24-01-2024 13:29:50,GEM BOT,rejected,
GEM_2024_B_4510177,"NVR,CAMERA,FIBER MEDIA CONVERTOR,GIGA SWITCH,SMPS,PATCH CORD,HDD,ELECTRIC BOARD",Ministry of Defence Department of Military Affairs,20-01-2024 13:19:38,GEM BOT,rejected,
GEM_2024_B_4510262,"OTG Cable,BNC to BNC coupler,BNC to BNC female connector,N type female to BNC Female Conector,C typ",Ministry of Defence Department of Military Affairs,20-01-2024 05:20:47,GEM BOT,rejected,
GEM_2024_B_4510292,"SMPS TESTER,NETWORK LAN TESTER,Clamp Meter,Tool Kit,GREASE GUN",Ministry of Defence Department of Military Affairs,20-01-2024 05:06:16,GEM BOT,rejected,
GEM_2024_B_4510299,MULTI-PROTOCOL LABEL SWITCHING SERVICE(MPLS SERVICE),Ministry of Finance Department of Financial Services,20-01-2024 05:11:59,GEM BOT,rejected,New-Corrigendum
GEM_2024_B_4510367,"Desktop computer,spike guard,Projector,Harddisk,switch",Ministry of Education Department of School Education and Literacy,21-01-2024 05:07:09,GEM BOT,rejected,
GEM_2024_B_4510375,"8 CHANNEL NVR,4 MP IP IR BULLET CAMERA,4 TB SURVILANCE HDD,8 PORT POE SWITCH,CAT 6 D LINK OUTDOOR C",Rural Development Department,20-01-2024 05:12:57,GEM BOT,rejected,
GEM_2024_B_4510392,"Cat6a,IO,PVC,Jack Panel,PC-3m,PC-2m,Rack,Switch,UPS,CID Phone,KTS,EPABX,VP,Fibre Cable,Voice Cable,",Ministry of Electronics and Information Technology Department of Electronics and Information Technology,20-01-2024 05:15:32,GEM BOT,rejected,
GEM_2024_B_4510409,"Solenoid Switch 24V,Ram Assy,Field Coil,Brush Carrier,Clutch Booster,Door Mechanism,Speedometer Sen",Ministry of Defence Department of Military Affairs,20-01-2024 05:13:24,GEM BOT,rejected,
GEM_2024_B_4510437,"UPS 2 2 KVA Offline,Printer Epson 3210,BenQ Projector TH585P,Smart Managable Switch 24 Port,USB Cab",Ministry of Defence Department of Military Affairs,20-01-2024 05:12:50,GEM BOT,rejected,
GEM_2024_B_4510454,"ASSY HEAD LAMP LH LUMAX,LAMP UNIT VEHICULAR,ARMATURE ASSY,SOLENOID SWITCH,FIELD COIL ASSY,BRUSH GEA",Ministry of Defence Department of Military Affairs,20-01-2024 05:13:15,GEM BOT,rejected,
GEM_2024_B_4510508,"Piano Type Non Modular Domestic Electrical sockets - IS 1293,modular electrical switches and access",Ministry of Defence Department of Military Affairs,20-01-2024 05:13:04,GEM BOT,rejected,
GEM_2024_B_4510584,"Bacterial incubator, shaking and static,Laminar air flow,Water bath ,2 racks,Autopipette,set,Magnet",Higher Education Department Odisha,20-01-2024 05:21:41,GEM BOT,rejected,
GEM_2024_B_4510592,"Camera for CCTV System,Camera for CCTV System,Video Recorder for CCTV System (V2),Installation and ",Ministry of Defence Department of Military Affairs,20-01-2024 05:21:29,GEM BOT,rejected,
GEM_2024_B_4510665,"Adaptor,Adaptor,Adaptor,Wire,Door Limit Switch,Connector,Led Light,Seat Flush NO Switch,LDR Sensor,",Ministry of Home Affairs NA,20-01-2024 05:14:01,GEM BOT,rejected,
GEM_2024_B_4510714,"Window Glass Pane 24 inch x 18 inch,Tube light 4ft 20 Watt,5 Amp Switch Socket with PVC box,Wire Me",Ministry of Defence Department of Military Affairs,20-01-2024 05:13:33,GEM BOT,rejected,
GEM_2024_B_4510772,"Computer, LED TV, Network setup, Online UPS, Printer",School Education Department Madhya Pradesh,21-01-2024 05:05:35,GEM BOT,rejected,
GEM_2024_B_4510840,"Epson Eco Tank L15150,Network Card,Power Cable,USB Cable,Printer Software CD",Ministry of Defence Department of Military Affairs,21-01-2024 05:04:26,GEM BOT,rejected,
GEM_2024_B_4510948,"NETWORK ATTACH STORAGE,USB CABLE,NETWORK CABLE,POWER ADOPTER,HARD DISK 2 TB",Ministry of Defence Department of Military Affairs,21-01-2024 05:04:33,GEM BOT,rejected,
GEM_2024_B_4510950,Camera for CCTV System,Panchayats and Rural Housing Department Gujarat,21-01-2024 05:18:05,GEM BOT,rejected,
GEM_2024_B_4510979,"BTY LEAD WITH TERMINALS,SR998,FUEL PIPE 19,FUEL HOSE PIPE,AVR ASSY,OIL FILTER,TOGGLE SWITCH,POLYTHE",Ministry of Defence Department of Military Affairs,21-01-2024 05:07:02,GEM BOT,rejected,
GEM_2024_B_4511004,"Vest for Cross Country Team,Beer Mug,Chair Revolving Office,CCTV Camera,Water Heating Drums",Ministry of Defence Department of Military Affairs,21-01-2024 13:22:26,GEM BOT,rejected,
GEM_2024_B_4511007,"26260616 26259358 ARMATURE ASSY,2624200126249929 DRIVE ASSY,26248010 SOLINOID SWITCH,26247140 Drive",Ministry of Defence Department of Defence,21-01-2024 05:07:53,GEM BOT,rejected,
GEM_2024_B_4511057,"PRESSURE PLATE FOR MARUTI GYPSY,ASSY SLAVE CYLINDER FOR TATA 2.5 TON,SOLENOID SWITCH FOR TATA 2.5 T",Ministry of Defence Department of Military Affairs,21-01-2024 05:06:52,GEM BOT,rejected,
GEM_2024_B_4511093,"Bty Leo Jammer,Dip Switch,Toggle Switch Small Size,Inductor,Toggle Switch Med Size",Ministry of Defence Department of Military Affairs,21-01-2024 13:19:08,GEM BOT,rejected,
GEM_2024_B_4511094,"WATER PROOF HEAD LAMP,WINDOW DROPPER,HYD HOSE,GLOW PLUG,OIL FILTER,BATTERY CUTT OFF SWITCH,TANDEM M",Ministry of Defence Department of Military Affairs,21-01-2024 13:19:01,GEM BOT,rejected,
GEM_2024_B_4511127,"PRESENTATION DISPLAY BOARD,UPS,SWITCH BOARD,WIRE HY DUTY,WOODEN MULTI PLUG CASE",Ministry of Defence Department of Military Affairs,21-01-2024 13:19:15,GEM BOT,rejected,
GEM_2024_B_4511128,"Power Point Presenter Logitech,Media Converter,HDMI Cable,Motion Sensor,LAN Cable Cat 6,Traffic Bat",Ministry of Defence Department of Military Affairs,20-01-2024 05:06:46,GEM BOT,rejected,
GEM_2024_B_4511167,"Pedestal Fan 500 mm,Dash camera for vehicles with display 2 inch high resolution TFT less angle min",Ministry of Defence Department of Military Affairs,20-01-2024 13:19:46,GEM BOT,rejected,
GEM_2024_B_4511214,"10 km Transceiver,10 km Transceiver SFP Module,24 port switch manageable,24 port non manageable swi",Ministry of Defence Department of Military Affairs,21-01-2024 05:14:08,GEM BOT,rejected,
GEM_2024_B_4511242,"ptz camera,media convertor,cable 5mtr,adaptor poe switch,joint closer,tape,rj 45 connector,12 v ada",Ministry of Defence Department of Military Affairs,21-01-2024 13:21:13,GEM BOT,rejected,
GEM_2024_B_4511315,Unmanned Aerial Vehicle & Payload Systems for Surveillance,Ministry of Home Affairs Central Police Organisation,20-01-2024 13:18:23,GEM BOT,rejected,
GEM_2024_B_4511330,"ip camera 2mp incl instlation charges,cat 6 cable double jacket 305mtr,poe switch,media convertor,j",Ministry of Defence Department of Military Affairs,21-01-2024 13:19:31,GEM BOT,rejected,
GEM_2024_B_4511336,"Rice or Dal Cleaning Machine,Extension Wire,MCB,Safety Switch,Anchor and Bolt set",Ministry of Defence Department of Military Affairs,21-01-2024 13:19:22,GEM BOT,rejected,
GEM_2024_B_4511342,"64 Channel Network Video Recorder for BPCL Raiganj LPG Bottling Plant,Supply and installation of 10",Ministry of Petroleum and Natural Gas Bharat Petroleum Corporation Ltd,21-01-2024 05:04:41,GEM BOT,rejected,
GEM_2024_B_4511355,"Flap barrier gate,Face and card based access control terminal,card based access control terminal,So",Higher Education Department Jammu and Kashmir,20-01-2024 13:20:25,GEM BOT,rejected,
GEM_2024_B_4511406,"BEARING CLUTCH RELEASE,ASSY WIPER BLADE,BRUSH GEAR ASSY,SOLENOID SWITCH,UNIVERSAL CROSS JOINT,ASSY ",Ministry of Defence Department of Military Affairs,21-01-2024 05:09:36,GEM BOT,rejected,
GEM_2024_B_4511451,"CONVERTER,WHITE BOARD TEACHING POINTER,EXTENSION CORD,MCB 32A DOBBLE POLE,SWITCH ANCHOR",Ministry of Defence Department of Military Affairs,22-01-2024 05:01:29,GEM BOT,rejected,
GEM_2024_B_4511571,"Bush,Fly Wheel Ring 138 Teeth,Fan Belt 926,Self Bush,Front Hub Oil Seal,Ignition Switch,Clutch Cyl ",Ministry of Defence Department of Military Affairs,21-01-2024 05:08:34,GEM BOT,rejected,
GEM_2024_B_4511576,"Damping Pad,Reverse Light Switch,Slave Cyl Rep Kit,Slave Cyl Assy,Solenoid Valve,Fuel Filter 3 Pipe",Ministry of Defence Department of Military Affairs,21-01-2024 05:08:26,GEM BOT,rejected,
GEM_2024_B_4511767,Custom Bid for Services - OPERATION AND MAINTENANCE OF ELECTRICAL LT NETWORK AND ELECTRICAL MAINTEN,Ministry of Defence Department of Defence Production,21-01-2024 05:06:00,GEM BOT,rejected,
GEM_2024_B_4511784,"2 MP PTZ Camera,16 Channel NVR,5 Port LAN Switch,PVC Box,Cat 6 Cable,Outdoor Metal Box,UPS Single B",Ministry of Defence Department of Military Affairs,20-01-2024 13:20:36,GEM BOT,rejected,
GEM_2024_B_4511830,"Netro SFP Module 40 KM LC,HDMI Jointer,WD SSD M 2 480 GB,DIGSol 16 Port Giga Switch,Cadyce HDMI TX ",Ministry of Defence Department of Military Affairs,21-01-2024 05:08:58,GEM BOT,rejected,
GEM_2024_B_4511835,"CAT 6 OUTDOOR,24 PORT LIU FMS FULLY LOADED,ADAPTER 12V 2 AMP,12 U RACK FULLY LOADED,INSTTALLATION C",Ministry of Defence Department of Military Affairs,21-01-2024 13:22:39,GEM BOT,rejected,
GEM_2024_B_4511872,"TP Link Giga LAN Card,Presenter Stick,SATA SSD 1 TB,Lap care Adapter ACER,Lap care Bty ACER,VGA to ",Ministry of Defence Department of Military Affairs,21-01-2024 05:02:51,GEM BOT,rejected,
GEM_2024_B_4511886,"Camera,POE Switch,Outdoor Box,Power Spick,Adaptor,OFC Cable,ONU,Fiber patch Cable,Cat 6 Cable",Ministry of Defence Department of Military Affairs,20-01-2024 13:22:11,GEM BOT,rejected,
GEM_2024_B_4511932,"Camera For CCTV System,8 Channal HD DVR Outdoor Camera,Cables Suitable For CCTV System,MONITOR 43 I",Department of Panchayati Raj,20-01-2024 13:18:44,GEM BOT,rejected,
GEM_2024_B_4512013,Unmanned Aerial Vehicle (Drone Camera) for (MHA),Ministry of Defence Department of Military Affairs,21-01-2024 13:22:54,GEM BOT,rejected,
GEM_2024_B_4512018,"LAN Card,Keyboard and Mouse Combo,SMPS,OPC Drum 3518 A,RAM DDR 4 4 GB",Ministry of Defence Department of Military Affairs,23-01-2024 13:17:21,GEM BOT,rejected,
GEM_2024_B_4512019,Repair and Overhauling Service - Repair and Upgradation of Desktop Computer; ACER; Yes; Service Pro,Ministry of Defence Department of Military Affairs,21-01-2024 13:22:19,GEM BOT,rejected,
GEM_2024_B_4512083,"CCTV Camera,Cable,DVR,Hard Disk,Connector",Ministry of Defence Department of Military Affairs,21-01-2024 05:17:59,GEM BOT,rejected,
GEM_2024_B_4512119,Digital Fundus Camera,Ministry of Defence Department of Military Affairs,26-01-2024 05:55:30,GEM BOT,rejected,
GEM_2024_B_4512245,"Heated Seat Cover for Ashok Leyland Stallion,Battery Operated Heated Hand Gloves for Driver,Integra",Ministry of Defence Department of Military Affairs,26-01-2024 06:02:34,GEM BOT,rejected,
GEM_2024_B_4512343,"Annual Maintenance Service - Desktops,  Laptops and Peripherals - Desktop PC; Acer,Annual Maintenan",Ministry of Education Department of School Education and Literacy,21-01-2024 13:25:18,GEM BOT,rejected,Open
GEM_2024_B_4512399,Piano Type Non Modular Electrical Switch Socket Combination as per IS 3854 and IS 1293,Ministry of Defence Department of Defence Production,21-01-2024 05:16:22,GEM BOT,rejected,
GEM_2024_B_4512418,"PUMP COOLANT,IGNITION STARTER SWITCH,CLUTCH ASSY FAN,HOSE FILTER FUEL,JOINT ASSY UNIVERSAL,OIL HEAD",Ministry of Defence Department of Military Affairs,21-01-2024 05:09:26,GEM BOT,rejected,
GEM_2024_B_4512466,"443815432020 MASTER SWITCH,NK002805 PNEUMATIC VALVE,NK001854 MTG SUSPENSION MED,NK000563 CLUTCH REL",Ministry of Defence Department of Military Affairs,21-01-2024 05:09:45,GEM BOT,rejected,
GEM_2024_B_4512501,"1080P Aeromodel Spy Camera,TS 335 FPV 58G Transmitter,Fastshark 58G RPSM Antenna,Distilled Water,2 ",Ministry of Defence Department of Military Affairs,21-01-2024 13:23:08,GEM BOT,rejected,
GEM_2024_B_4512532,"Hose Assy,Side Lamp Type PF 101,Bulb 24 21,Lamp Cabin Type,Switch,Side Indicator,Double Tone Electr",Ministry of Defence Department of Military Affairs,21-01-2024 13:19:40,GEM BOT,rejected,
GEM_2024_B_4512650,"BTY TROLLEY,WALL CLOCK,METAL POT SET,CANON CAMERA,INVERTER WITH BATTERY",Ministry of Defence Department of Military Affairs,21-01-2024 13:23:01,GEM BOT,rejected,
GEM_2024_B_4512659,"RJ 45 D Link,RJ 45 Couple Connector,RJ 45 2 in 1 Connector,HDMI Cable 20 mtr,HDMI Cable 15 mtr,Mini",Ministry of Defence Department of Military Affairs,21-01-2024 13:23:40,GEM BOT,rejected,
GEM_2024_B_4512678,"Qubo Camera with SD Card 256 GB,Epson M200,Epson M100,Epson L210 Colour,Epson L3115 Colour,Cartridg",Ministry of Defence Department of Military Affairs,21-01-2024 13:23:23,GEM BOT,rejected,
GEM_2024_B_4512777,"SPLIT AC 1.5 TONNE 5 STAR,CELLING MOUNTED PROJECTOR WITH ACCESSORIES,3 IN ONE LASER PRINTER,ONLINE ",Ministry of Education Department of Higher Education,21-01-2024 13:24:44,GEM BOT,rejected,
GEM_2024_B_4512807,"SERVER,ZERO CLIENTS,MONITOR,Input,NETWORKING",Ministry of Education Department of School Education and Literacy,21-01-2024 05:04:59,GEM BOT,rejected,
GEM_2024_B_4512832,"16 MODULE BOX,15 A SOCKET,5 A SWITCH,FAN REGULATOR SWITCH TYPE,CASING CAPPING,6 MODULE BOX,15 A SWI",Ministry of Education Department of School Education and Literacy,21-01-2024 05:10:29,GEM BOT,rejected,
GEM_2024_B_4512920,"STEERING LOCK,ELECTRONIC FUEL PUMP,EQUALIZER REP KIT,HEAD LIGHT SWITCH,COMBINATION SWITCH,BTY CUT O",Ministry of Defence Department of Military Affairs,21-01-2024 05:10:38,GEM BOT,rejected,
GEM_2024_B_4512924,Sony Point and Shoot Camera,Ministry of Home Affairs Central Armed Police Forces,21-01-2024 13:23:46,GEM BOT,rejected,
GEM_2024_B_4512963,"Fuel Filter large,Fuel Filter small,Baby Fuel Filter,Oil Filter,Bty Cut off Switch,Fog Light Assy,H",Ministry of Defence Department of Military Affairs,21-01-2024 05:15:48,GEM BOT,rejected,
GEM_2024_B_4513047,Endress Hauser Make COOLING WATER FLOW SWITCH Range 0-200 LPM,Ministry of Chemicals and Fertilizers Department of Fertilizers,21-01-2024 05:16:29,GEM BOT,rejected,
GEM_2024_B_4513172,"16 port DVR,dome camera,bullet camera,eathernet cable CAT6,BNC connector,power supply SMPS,outdoor ",Ministry of Education Department of School Education and Literacy,21-01-2024 13:23:54,GEM BOT,rejected,
GEM_2024_B_4513194,"switcher customize,rj 45 dlink,funne fuel manual,9volt dura cell,brass nut bty",Ministry of Defence Department of Military Affairs,21-01-2024 05:10:20,GEM BOT,rejected,
GEM_2024_B_4513224,"Battery to Connector Box Main Lead dia 19mm,Safety Thermo Switch,Lever Launching AM-50,Tail Light A",Ministry of Defence Department of Military Affairs,21-01-2024 05:10:03,GEM BOT,rejected,
GEM_2024_B_4513246,fluroscence microscope with camera,Ministry of Science and Technology Department of Scientific and Industrial Research (DSIR),24-01-2024 05:23:54,GEM BOT,rejected,
GEM_2024_B_4513283,"DVR 8CH,CAMERA 2MP NIGHT COLOUR,HDD 1TB,SMPS,BNC,DC PIN,WIRE 3 Plus 1,ACCESSORIES,DVR RACK 2U,INSTA",Health Department Haryana,24-01-2024 05:20:19,GEM BOT,rejected,
GEM_2024_B_4513376,"5 VOLT ADAPTER,12 VOLT ADAPTER,5 PORT GHZ,8 PORT SWITCH GHZ,POE SWITCH,BNC CONNECTOR,IP CAMERA HIKV",Ministry of Defence Department of Military Affairs,21-01-2024 05:10:56,GEM BOT,rejected,
GEM_2024_B_4513516,CCTV,Tribal Welfare and Scheduled Caste (SC) Department Madhya Pradesh,21-01-2024 05:18:32,GEM BOT,rejected,
GEM_2024_B_4513550,CCTV CAMERA,Revenue Department Uttar Pradesh,21-01-2024 05:18:25,GEM BOT,rejected,Open
GEM_2024_B_4513558,"CCTV CAMERA ALL ITIEM INCLUDED, TV, HARD DISK,CCTV ON RENT WITH WIRE, HDR MONITOR INSTALLANTION AND",Revenue Department Uttar Pradesh,21-01-2024 05:18:19,GEM BOT,rejected,Open
GEM_2024_B_4513573,UAV CAMERA FOR FOREST FIELD MONITORING,Forests and Wild Life Department Punjab,21-01-2024 13:24:00,GEM BOT,rejected,
GEM_2024_B_4513594,"Pannal Light,Cobe Light,Modular board with Socket And Switch,Ac Box,Labour And Mic Item",Ministry of Defence Department of Military Affairs,21-01-2024 05:10:45,GEM BOT,rejected,
GEM_2024_B_4513621,"Off load Change over switch 16 Amp 2 pole with enclosure,Offload Change over switch 32 Amp 2 pole w",Ministry of Defence Department of Military Affairs,21-01-2024 05:11:28,GEM BOT,rejected,
GEM_2024_B_4513730,"Microdebrider High End,HD Camera with Recording system High End,ENT Operating microscope,Advanced s",Medical Education and Drugs Department Maharashtra,21-01-2024 13:30:52,GEM BOT,rejected,
GEM_2024_B_4513731,"VIDEO CAMERA PARTIDIN 24 HOURS,02 TB HD,VIDEO CAMERA JANPAD KE BAHAR SE MANGAYE JAANE PAR PRATI CAM",Revenue Department Uttar Pradesh,21-01-2024 13:24:36,GEM BOT,rejected,
GEM_2024_B_4513748,"24 port Gigabit managed switch,Single Mode Media Convertor,8 port Optical Fiber terminal Box,OFC Pa",Ministry of Home Affairs Central Armed Police Forces,23-01-2024 05:09:42,GEM BOT,rejected,
GEM_2024_B_4513761,Night Vision Camera with UAV thermal Scanner - Mountable with Drone,Ministry of Defence Department of Military Affairs,24-01-2024 05:23:40,GEM BOT,rejected,
GEM_2024_B_4513765,"Fan Belt 1364,Bty Cut Off Switch,Suspension Bush Kit,Stearing Gear Box Oil Seal,Universal Joint,Doo",Ministry of Defence Department of Military Affairs,21-01-2024 13:19:55,GEM BOT,rejected,
GEM_2024_B_4513822,"Head light RH,Alternator Belt no 1795,Fog light bulb,Ignition Switch,Spark plug,Repair scorpio incl",Ministry of Defence Department of Military Affairs,22-01-2024 13:18:11,GEM BOT,rejected,
GEM_2024_B_4513872,"FUEL FILTER ASSY,ISOLATOR SWITCH,TAIL LAMP LH,FILTER ASSEMBLY FUEL,CABLE ASSY CONTROL,ELEMENT OIL F",Ministry of Defence Department of Military Affairs,21-01-2024 05:15:24,GEM BOT,rejected,
GEM_2024_B_4513898,"Computer System,Wired Headset,Webcam,Printer with Scanner,Electrification in Lab,LAN Networking,Com",Ministry of Education Department of School Education and Literacy,21-01-2024 05:04:05,GEM BOT,rejected,
GEM_2024_B_4514031,"Rear view camera,Rear view dashboard screen,Cable for rear view camera,RCA Audio Video Jack Rear Vi",Ministry of Defence Department of Military Affairs,21-01-2024 13:24:28,GEM BOT,rejected,
GEM_2024_B_4514057,"FIBER PROPELLERS MEDUIM,ELECTRONIC BATTERY,ASSEMBLED SVL DRONE MEDIUM,FIBER PROPELLERS SMALL,ELECTR",Ministry of Defence Department of Military Affairs,26-01-2024 05:47:17,GEM BOT,rejected,
GEM_2024_B_4514082,"Pendant holder,Bed switch,SSC 16 Amp with G Box,Extension cord 16 Amp,Plug Top 15 Amp,Plug Top 5 Am",Ministry of Defence Department of Military Affairs,21-01-2024 05:16:16,GEM BOT,rejected,
GEM_2024_B_4514096,PTZ camera zoom in and out 360 degree rotating,Ministry of Defence Department of Military Affairs,21-01-2024 13:24:21,GEM BOT,rejected,
GEM_2024_B_4514104,CCTV Camera,Department of Panchayati Raj,21-01-2024 05:19:20,GEM BOT,rejected,
GEM_2024_B_4514136,"Thermal Printer,Speaker,Table mic,Web Camera,Installation and Wiring Charges",Ministry of Defence Department of Military Affairs,21-01-2024 13:24:15,GEM BOT,rejected,
GEM_2024_B_4514147,CCTV CAMERA ANNUAL MAINTENANCE,Ministry of Defence Department of Defence,21-01-2024 05:18:51,GEM BOT,rejected,
GEM_2024_B_4514161,"8411200494 Ethernet TCP/IP managed switch-ConneXium-6TX/2FX-Multimode,8411250063 INDUSTRIAL ETHERNE",Ministry of Petroleum and Natural Gas CHENNAI PETROLEUM Corporation Limited,21-01-2024 05:12:56,GEM BOT,rejected,
GEM_2024_B_4514162,"Vocational Training For Students,DIY Drone,Humanoid Kit,3D Printer,UPS for 3D Printer,Filament,Meta",Ministry of Education Department of School Education and Literacy,21-01-2024 13:27:30,GEM BOT,rejected,
GEM_2024_B_4514204,"2MP IP Bullet Camera,2MP IP dome Camera,64 port NVR,10tb SV HDD,Poe switch 16ch,Networking switch,b",Ministry of Agriculture and Farmers Welfare Department of Agricultural Research and Education (DARE),21-01-2024 05:05:43,GEM BOT,rejected,
GEM_2024_B_4514209,"LAN Extender DSL1540G D LINK,LAN Cable 305 Mtr Roll D Link,RJ 45,Crimping Tool,8 Port Switch,5 Port",Ministry of Defence Department of Military Affairs,21-01-2024 05:03:57,GEM BOT,rejected,
GEM_2024_B_4514247,"CCTV CAMERA,NVR,POE,LED TV,CABLE,CABLE,FIBRE,HDD,RACK,COMPUTER,LAMINATION MACHINE,COMPUTER PRINTER",Panchayats and Rural Housing Department Gujarat,26-01-2024 05:41:00,GEM BOT,rejected,
GEM_2024_B_4514289,"Annual maintenance Contract for Desktop, Networking, CCTV and peripherals.",Ministry of Education Department of School Education and Literacy,21-01-2024 05:05:29,GEM BOT,rejected,
GEM_2024_B_4514406,"Desktop Computer,Multifinction Printer,Passbook Printer,Alarm System,2 Channel CCTV Setup,4 Channel",Banda,21-01-2024 05:19:43,GEM BOT,rejected,
GEM_2024_B_4514457,Custom Bid for Services - CAMC of CCTV system installed at Tehri project,Ministry of Power NA,23-01-2024 05:12:58,GEM BOT,rejected,Open
GEM_2024_B_4514492,"VTS Central Processing Unit,Visual Display Unit LED 22 Inch,Power Supply Unit 1000VA,PTZ Camera,NVI",Ministry of Defence Department of Military Affairs,21-01-2024 13:24:52,GEM BOT,rejected,
GEM_2024_B_4514579,Custom Bid for Services - To Undertake CCTV Commissioning onboard INS Shardul,Ministry of Defence Department of Defence Production,21-01-2024 05:17:52,GEM BOT,rejected,New-Corrigendum
GEM_2024_B_4514585,"Audio DSP,Amplifier,Boundary Microphone,Speakers,Network Switch,Accessories",Ministry of Home Affairs Department of Border Management,21-01-2024 05:05:15,GEM BOT,rejected,
GEM_2024_B_4514644,Unmanned Aerial Vehicle & Payload Systems for Surveillance,Revenue and Forest Department Maharashtra,21-01-2024 13:17:53,GEM BOT,rejected,New-Corrigendum
GEM_2024_B_4514685,"Network Attached Storage (NAS) Device,Hard disk drives",Ministry of Power NA,26-01-2024 05:17:52,GEM BOT,rejected,
GEM_2024_B_4514846,"Desktop Computer,Multifunction Printer,Line Interactive UPS,Anti virus,Web Camera,Desktop Speaker",Works Department Odisha,21-01-2024 13:26:33,GEM BOT,rejected,
GEM_2024_B_4514904,"AMC of Integrated Security and Surveillance System - Facility/Asset Protection, Remote Video Monito",Education Department Gujarat,21-01-2024 05:04:11,GEM BOT,rejected,Open
GEM_2024_B_4514910,"Laptop,A3 Scanner,External 2 TB HDD,MFD,Compactor,Server,1 KVA UPS,600 VA UPS,Desktop,LCD projector",Revenue & Disaster Management Department Assam,21-01-2024 13:25:30,GEM BOT,rejected,
GEM_2024_B_4514937,Drive Unit (Handle Assy) for 250 Amps switch disconnector in 200 Amps socket unit.,Ministry of Coal Materials Management,21-01-2024 05:17:16,GEM BOT,rejected,
GEM_2024_B_4514962,vector network analyzer with buy back option,Ministry of Science and Technology Department of Science and Technology (DST),21-01-2024 05:06:06,GEM BOT,rejected,
GEM_2024_B_4514963,"HD Camera,Display,Connectors,Wire,Display Stand",Ministry of Defence Department of Military Affairs,21-01-2024 13:26:58,GEM BOT,rejected,
GEM_2024_B_4514970,"Interactive Display,OPS,Camera Video Conference,Conference MIC,Air Conditioner",Ministry of Education Department of Higher Education,21-01-2024 13:25:52,GEM BOT,rejected,
GEM_2024_B_4515014,"CP Plus DVR 8 Channel,HDD 2 tb Cp Plus,CC TV camera dome 5mp CP Plus,CC TV camera Billet 5mp CP Plu",Public Works Department,21-01-2024 13:25:44,GEM BOT,rejected,
GEM_2024_B_4515063,"LYNX HDMI CMOS CAMERA FOR PENTA HEAD MICROSCOPE,SMARTBOARD SCREEN FOR PENTA HEAD MICROSCOPE",Medical Education and Drugs Department Maharashtra,21-01-2024 13:25:36,GEM BOT,rejected,
GEM_2024_B_4515071,"CCTV 1,CCTV 2,CCTV 3,CCTV 4,PTZ",Revenue Department Gujarat,21-01-2024 05:18:59,GEM BOT,rejected,Open
GEM_2024_B_4515117,"Socket Modular 6 AMP make Roma Anchor,Switch Modular 6 Amp make Roma Anchor,Socket Modular 16 Amp m",Ministry of Education Department of Higher Education,21-01-2024 05:13:33,GEM BOT,rejected,
GEM_2024_B_4515142,"Motorola Charger With Adopter,Motorola Antina,Adopter Motorola,Charger 12 V,Rotar Assy,Timing Belt,",Ministry of Defence Department of Military Affairs,21-01-2024 13:27:06,GEM BOT,rejected,
GEM_2024_B_4515265,"FIELD COIL ASSSY,PINION,ISOLATOR SWITCH,SOLENOID SWITCH,PACK RECTTIFIER,RECTIOFIER ASSY,VOLTAGE REG",Ministry of Defence Department of Military Affairs,21-01-2024 05:13:49,GEM BOT,rejected,
GEM_2024_B_4515330,NETWORK SWITCH 24 PORT MANAGED,Ministry of Defence Department of Military Affairs,23-01-2024 05:06:19,GEM BOT,rejected,
GEM_2024_B_4515333,"CLI Telephone Set,DMR Bty Charger with Base,DMR Volume Switch Knob,DMR Channel Switch Knob,Bty 7 4 ",Ministry of Defence Department of Military Affairs,21-01-2024 05:13:40,GEM BOT,rejected,
GEM_2024_B_4515336,"CCTV RO Office Amreli ARO Office Amreli,CCTV AC Strongroom and EVM Commissioning,CCTV Counting Cent",General Administration Department Gujarat,21-01-2024 05:19:13,GEM BOT,rejected,Open
GEM_2024_B_4515363,"Desktop Computers,All in one Desktop,Network Laserjet Printer,Multifunction Laserjet Printer,Solid ",Ministry of Finance Department of Financial Services,21-01-2024 05:05:06,GEM BOT,rejected,
GEM_2024_B_4515412,"CCTV Camera,8Channel DVR,3TB HDD,CCTV Cable,DVR Rack 8 Channel,HDMI Cable,Adapter,Advanced All in O",Ministry of Defence Department of Military Affairs,21-01-2024 13:26:25,GEM BOT,rejected,
GEM_2024_B_4515431,"DISTRIBUTOR HEAD,LINING FRICTION,PACK RECTIFIER,LOW OIL PRESSURE SWITCH,RECTIFIER ASSY,CIRCUIT BREA",Ministry of Defence Department of Military Affairs,21-01-2024 05:13:58,GEM BOT,rejected,
GEM_2024_B_4515440,"Bosch Heavy Duty Jigsaw,GHO 10 to 82 Electric Randa,28 U Network Rack,Capping Casing 25 mm,Capping ",Ministry of Defence Department of Military Affairs,21-01-2024 13:18:09,GEM BOT,rejected,
GEM_2024_B_4515512,Certified Network Associate and Cyber Security Book,Ministry of Defence Department of Military Affairs,26-01-2024 05:16:26,GEM BOT,rejected,
GEM_2024_B_4515560,"DVR,CAMERA,BNC,SMPS,DC CONNECTOR,CABLE",Ministry of Defence Department of Military Affairs,21-01-2024 13:29:15,GEM BOT,rejected,
GEM_2024_B_4515572,Installation and Commissioning Charges for CCTV Cameras (Accessories),Ministry of Education Department of School Education and Literacy,22-01-2024 05:04:10,GEM BOT,rejected,
GEM_2024_B_4515576,"Dashboard Camera,Dashboard Camera,Dashboard Camera",Ministry of Defence Department of Military Affairs,21-01-2024 13:22:12,GEM BOT,rejected,
