tender_id,name_of_work,customer,inserted_time,inserted_user_id,verification_1,done
2023_DRDP_113490_11,Construction of Health and Wellness Centre at Village Boparai Kalan Block Chogawan,Department of Rural Development and Panchayats||Panchayati Raj (Engineering Wing)||Division - Amritsar,26-01-2024 08:16:00,PBTenders GOV NICGEP BOT,rejected,
2023_DRDP_114484_3,Supply of skilled labour and material for construction of Panchayat Building at Village Panjgrain Kalan Block Kotkapura Distt. Faridkot (MGNREGA Convergence Work),Department of Rural Development and Panchayats||Panchayati Raj (Engineering Wing)||Division - Moga,26-01-2024 08:11:37,PBTenders GOV NICGEP BOT,rejected,
2023_EB_404466_1,Procurement of Supply and Erection of CCTV Cameras and its accessories,TNEB Limited||TANGEDCO||CE-NCTPS-II - TANGEDCO||SE-Purchase and Administration-NCTPS-II - TANGEDCO,20-01-2024 08:40:30,Tntenders GOV NIC BOT,rejected,
2023_GSCT_35054_1,"SELECTION OF SYSTEM INTEGRATOR FOR INTELLIGENT CITY SURVEILLANCE SYSTEM IN GUWAHATI ON DESIGN, SUPPLY, IMPLEMENTATION AND OPERATION AND MAINTENANCE FOR 5 YEARS BASIS",Guwahati Smart City Ltd.,30-12-2023 02:30:33,Assam GOV NICGEP BOT,approved,Not Submitted
2023_HO_83276_1,"Supply of all types of Electric, Electronic Items, Energy Saving Equipment, Solar System Appliances, CCTV, Central Heating, Cooling System, Public Address System, Smart Classroom Solutions and Vocational, Industrial Training Equipment , AMC etc",HP State Civil Supplies Corporation Limited,30-12-2023 05:30:46,HPtenders GOV NICGEP BOT,approved,Not Submitted
2023_HRY_325473_1,Annual Maintenance for 1 Year of outdoor IP CCTV Surveillance Cameras installed at Various Locations under Municipal Corporation Panchkula.,Haryana Government||Urban Local Bodies||MC Panchkula,03-11-2023 05:41:07,HRYtenders GOV NICGEP BOT,approved,Not Submitted
2023_IIT-M_739753_1,Mounted Thermal Imaging Camera,Indian Institute of Technology Madras||Deputy Registrar (Industrial Consultancy and Sponsored Research),02-01-2024 04:00:46,Eprocure Epublish BOT,approved,Not Submitted
2023_IPGCL_251450_1,Removal of grass vegetation in 400KV switchyard and in bay no 413 415 of DTL yard Main Plant and BOP area at PPS III Bawana,IPGCL-PPCL||CS III,26-01-2024 03:41:18,DelhiTenders GOV NICGEP BOT,rejected,
2023_MDPEY_66258_2,CONSTRUCTION OF RESIDENCE BUILDING FOR POLICE PERSONNEL AT LAXMANJHULA and LANSDOWNE,MD (Drinking Water) Peyjal Nigam GoUK||CE (HQ) - Dehradun||GM (Admin),24-01-2024 09:03:04,UKtenders GOV NICGEP BOT,rejected,
2023_MHFW_66982_1,Procurement of Single Puncture Laparoscope with HD Camera and Single Puncture Laparoscope without Camera for various Govt. Hospital of Uttarakhand,MHFW - DG (Medical Health)||DIRECTOR (Stores)||AD (Stores)||JD (Stores),31-12-2023 09:00:08,UKtenders GOV NICGEP BOT,rejected,Open
2023_MPP_320085_1,Supply Installation Integration Commissioning and Maintenance of Integrated Security Surveillance System along with ANPR in 03 major cities of Madhya Pradesh,MP Police||Telecommunication BHOPAL - MPP,17-12-2023 07:31:50,Mptenders GOV BOT,approved,Not Submitted
2023_MPPGC_315225_1,"Annual work contract for Assistance in routine operation of Switchgear, Switchyard and its associated systems of 2x660 MW, PH-II, SSTPP, MPPGCL, Dongalia",Madhya Pradesh Power Generating Company Limited||Executive Director(Gen.)-Shri Singaji Thermal Power Station-Khandwa - MPPGCL,12-01-2024 07:53:05,Mptenders GOV BOT,rejected,Open
2023_MPPGC_317157_2,Supply Installation and commissioning of Furnace Camera system for continuous monitoring of Flame fireball inside furnace for Unit no5 AT SGTPS MPPGCL BIRSINGHPUR,Madhya Pradesh Power Generating Company Limited||Chief Engineer(Gen.)-Sanjay Gandhi Thermal Power Station-Birsinghpur - MPPGCL,16-01-2024 07:30:07,Mptenders GOV BOT,rejected,Open
2023_MPPGC_317366_1,Annual Work contract for Housekeeping of Control room of Real Time Effluent Quality Monitoring system RTEQMS as well as IP PTZ Camera and other related auxiliaries including cleaning of all Real Time Equipments for smooth operation along with it Brs,Madhya Pradesh Power Generating Company Limited||Chief Engineer(Gen.)-Sanjay Gandhi Thermal Power Station-Birsinghpur - MPPGCL,04-01-2024 07:30:07,Mptenders GOV BOT,rejected,Open
2023_MPPGC_322699_1,"Procurement of C and S make 415V, LV switchgear spares for 210 MW ATPS MPPGCL Chachai..",Madhya Pradesh Power Generating Company Limited||Chief Engineer(Gen.)-Amarkantak Thermal Power Station-Chachai - MPPGCL,23-01-2024 07:52:21,Mptenders GOV BOT,rejected,
2023_NNVAR_874940_17,"250MM DIA NP-3 SEWER LINE LAYING WORK FROM D.59/66-C-10-1 TO D.59/70-A INFRONT LANE OF PAL CHASHMA, SONKAR BASTI, MAHMOORGANJ IN DASHASHWAMEDH WARD",Varanasi Nagar Nigam Varanasi,21-01-2024 05:12:24,Etenders UP NIC BOT,rejected,
2023_NTPC_82035_1,"Supply, Installation and AMC of CCTV System for Plant Security at NTPCKhargone",NTPC Limited||Corporate Centre||USSC||CPG-1,08-12-2023 02:05:17,Eprocurentpc Nic Nicgep BOT,approved,Not Submitted
2023_PDD_241497_2,CREATION OF VARIOUS SUBSTATIONS ALONG WITH HT/LT NETWORK FOR VARIOUS WSS IN SUBDIVISION KOTRANKA UNDER JJM.,DC-PDD||CE-M and RE Wing Jammu||Rajouri||ED-Rajouri,26-01-2024 06:40:05,J&KTenders GOV NICGEP BOT,rejected,
2023_PGIME_784016_1,"Providing intercom and centralized surveillance monitoring system in all lifts installed at various locations, PGIMER, Chandigarh",Postgraduate Institute of Medical and Education and Research Chandigarh||Engineering department - PGIMER Chandigarh||H.E. Electrical - PGIMER Chandigarh||A.E. (Elect.1) - PGIMER Chandigarh,08-12-2023 02:53:24,Centerl GOV BOT,approved,Not Submitted
2023_PWD_251021_2,"Road Restoration work due to Road and Footpath damaged by Delhi Police CCTV Camera, BSES cable laying and other agencies work on the various locations of SER-14 of Division SER-1 during 2023-24",Public Works Department||CE/SE/M4-M41||EE/M412,24-01-2024 03:40:08,DelhiTenders GOV NICGEP BOT,rejected,
2023_UAD_268048_3,Augmentation of Water Supply Works for Newton Chikhli Kalan Under Amrut 2.0 - 3rd Call,Directorate Urban Administration and Development||Join Director-Jabalpur Division - UAD||Chhindwara-Nagar Parishad Newton Chikhli - UAD,20-01-2024 07:33:32,Mptenders GOV BOT,rejected,
2023_UAD_301995_2,"Providing, laying and Jointing of Distribution network of 300 mm K-7 D.I. Pipe Line with labour and material. Site ward 48. File no 159/23x9/1. 2nd Call",Directorate Urban Administration and Development||Muncipal Corporations - UAD||Muncipal Corporation-Gwalior - UAD||Water Supply (PHE) Deptt. - MC Gwalior - UAD,26-01-2024 07:55:20,Mptenders GOV BOT,rejected,
2023_UAD_312499_2,"Supply and installation of LED light and laying of street light cable network at Gourishankar Parisor Katara Ward No.85 Zone No.19, Bhopal. (Second Call)",Directorate Urban Administration and Development||Muncipal Corporations - UAD||Muncipal Corporation-Bhopal - UAD||Lighting Section - MC Bhopal- UAD,07-01-2024 08:06:13,Mptenders GOV BOT,rejected,Open
2023_UAD_320504_1,providing and Installing decorative pole with top lantern LED fitting at sagra mandir road,Directorate Urban Administration and Development||Join Director- Shehdol Division - UAD||Umaria-Nagar Palika Umaria - UAD,24-12-2023 07:39:29,Mptenders GOV BOT,rejected,Open
2023_ZPHD_628842_7,Construction of Grey Water Management System with Cover and Soakpit from Hazari para Krishna Shop Towards Chanchal ghosh Land at Briddhapara Wo,Zilla Parishad||Zilla Parishad||PURBA BARDHAMAN||KALNA- I||ATGHORIA SIMLON,27-01-2024 02:37:04,WBtenders GOV NICGEP BOT,rejected,
2024_APGCL_35655_1,"Supply of Various Consumable Materials for Karbi Langpi Hydro Electric Project (KLHEP), APGCL.",Assam Power Generation Company Limited,24-01-2024 02:30:22,Assam GOV NICGEP BOT,rejected,
2024_BandR_790236_1,"Civil Work including Electrical work, Sanitary AND Plumbing, External Water Supply System, Fire Protection System, Street Light, DG Set, CCTV, Landscaping and other Allied Works etc",Bridge and Roof Company (India) Limited||Corporate Head Quarters Kolkata Office - B and R,13-01-2024 02:54:30,Centerl GOV BOT,rejected,Open
2024_BCCL_298970_1,"Complete repairing of 550V, 400Amps, ACB switch Sl. No. 217C/NFLP/98, make-Andrew yule of Bhowra (south) Colliery.",Bharat Coking Coal Limited||BCCL_EJ AREA,20-01-2024 03:09:31,Coalindiatenders NIC Nicgep BOT,rejected,
2024_BCCL_298987_1,"Complete repairing/over hauling of 400Amp (LT) 440V oil CKT breaker switch, Sl No 30/0114, make - GEC of patherdih VI seam sub station under ASP Colliery",Bharat Coking Coal Limited||BCCL_EJ AREA,20-01-2024 03:09:50,Coalindiatenders NIC Nicgep BOT,rejected,
2024_BCCL_299498_1,"MAINTENANCE OF OLD WIRING AND INSTALLATION OF REQUIRED NEW WIRING AND FITTING OF SWITCHES SOCKET MCB,S ETC IN COMPANY QUARTER ALLOTTED TO SHRI DULAL CHANDRA BISWAS,PERS NO.61321199 AT SALANPUR COLLIERY OF KATRAS AREA.",Bharat Coking Coal Limited||BCCL_KATRAS AREA,26-01-2024 03:00:52,Coalindiatenders NIC Nicgep BOT,rejected,
2024_BoTC_35691_1,"Construction of 4 Nos. of ACR (G 1)at Naokata Milan Higher Secondary school, Baksa under BTC, funded by Samagra Siksha, Assam for the year 2023-24.",Bodoland Territorial Council||Education-BTC,26-01-2024 02:31:08,Assam GOV NICGEP BOT,rejected,
2024_BoTC_35717_1,"Request for Proposal to Select an Agency Development of Sanitary Landfill (SLF), at Kajalgaon, Assam",Bodoland Territorial Council||Urban Development Town and Country Planning-BTC,26-01-2024 02:30:26,Assam GOV NICGEP BOT,rejected,
2024_BSF_791573_1,Construction of 01 Nos (Gplus1) Surveillance Cum OP Points at BOP Panithar and 02 Nos (Gplus2) Surveillance Cum OP Point at BOP Gojadanga and Khalshi in AOR of 102 Bn BSF under SHQBSF Kolkata,"DG,BSF,MHA||South Bengal(Kolkata),BSF,MHA",26-01-2024 03:54:58,Centerl GOV BOT,rejected,
2024_BSF_791575_1,Construction of 02 Nos (Gplus2) Surveillance Cum OP Points at BOP Barunhat and Taki of 85 BN BSF under SHQ BSF Kolkata,"DG,BSF,MHA||South Bengal(Kolkata),BSF,MHA",26-01-2024 03:55:18,Centerl GOV BOT,rejected,
2024_BTVP_884547_1,JANPAD MATHURA ME GOVERDHAN BUS STATION PARISAR STISTH MULTILAVEL CAR PARKING KE DAINIK SANCHALAN AVM RAKHRAKHAV KA KARYA,Uttar Pradesh Braj Tirath Vikas Parishad,24-01-2024 05:10:49,Etenders UP NIC BOT,rejected,
2024_CCL_297652_1,Extension of existing WAN network through wi-fi for providing internet facility to the biometric attendance system at Dhori Area,Central Coalfields Limited||Dhori,05-01-2024 03:08:13,Coalindiatenders NIC Nicgep BOT,rejected,Open
2024_CCL_299284_6,Network connectivity for New 100 ton Weighbridge installed at AADOCM Project Dhori Area.,Central Coalfields Limited||Dhori,27-01-2024 03:08:58,Coalindiatenders NIC Nicgep BOT,rejected,
2024_CEALD_882655_5,Renewal of Raniganj Patti Road To Jamtali Shuklan Basti Link Road,Cheif Engineer Allahabad Zone PWD Allahabad||SE PRATAPGARH CIRCLE PWD PRATAPGARH||EE PROVINCIAL DIVISION PWD PRATAPGARH,26-01-2024 05:54:51,Etenders UP NIC BOT,rejected,
2024_CEALG_884605_1,Renewal of Borrakalan to Jalukheda Road in FY 2023-24,Chief Engineer Aligarh Zone PWD Aligarh||Superintending Engineer Aligarh Circle PWD Aligarh||Construction Division - 1 PWD Etah,26-01-2024 05:51:33,Etenders UP NIC BOT,rejected,
2024_CEALG_885543_1,Re Construction work on Etah Nidhauli Kalan road to Javaharpur Arthara road in financial year 2023-24,Chief Engineer Aligarh Zone PWD Aligarh||Superintending Engineer Aligarh Circle PWD Aligarh||Provincial Division PWD Etah,26-01-2024 05:31:34,Etenders UP NIC BOT,rejected,
2024_CEBLY_879161_2,Special Repair of Kalan Paroor Road to Sathri Dharmpur Link Road,Cheif Engineer Bareilly Zone PWD Bareilly||SE BAREILLY CIRCLE PWD BAREILLY ||EE CONSTRUCTION DIVISION-1 PWD SHAHJAHANPUR,22-01-2024 08:57:19,Tendersodisha GOV BOT,rejected,
2024_CEDPW_882882_11,Special Repair Work Of Jhala Kalan Link Road In District Bahraich Using Dept. HMP (Vidhan Sabha-Nanpara),Chief Engineer Devipatan (Gonda) Zone PWD Gonda||SE Bahraich - Shravasti Circle PWD Bahraich,20-01-2024 05:12:16,Etenders UP NIC BOT,rejected,
2024_CEEMP_883347_1,Gorakhpur ke annexy bhawan ke pratham tal par conferrencing hall ke nirman mein audio video system ewam cctv ki sthapana ka karya,Chief Engineer Electrical Mechanical PWD Lucknow||44th Circle Electrical Mechanical PWD Varanasi||Electrical Mechanical Division PWD Gorakhpur,21-01-2024 05:10:18,Etenders UP NIC BOT,rejected,
2024_CEEMP_884465_1,Vidhan Bhawan esthith Mukhya Bhawan Bhutal Vidhan Parishad evm shesh anaya kaksho hetu sthapit kendriya vatanukulan sayantra ke renovation ka karya,Chief Engineer Electrical Mechanical PWD Lucknow||30th Circle Electrical Mechanical PWD Lucknow,26-01-2024 05:53:14,Etenders UP NIC BOT,rejected,
2024_CEGKP_883115_11,Construction of GM Road 04 Lane (Basahiya) to Pachdeuri Link Road (with 05 year Maintainance) Lot No 11 of 11,Chief Engineer Gorakhpur Zone PWD Gorakhpur UP||GORAKHPUAR CIRCLE PWD GORAKHPUR,21-01-2024 05:12:58,Etenders UP NIC BOT,rejected,
2024_CEGKP_884039_1,Constrcution of gate on 04 lane road on the border of Lucknow Gopalganj Muzzaffarpur NH-27 Intersate- International Road in Dist Kushinagar in FY 2023-24,Chief Engineer Gorakhpur Zone PWD Gorakhpur UP||SE DEORIA CIRCLE PWD DEORIA,24-01-2024 05:17:54,Etenders UP NIC BOT,rejected,
2024_CEGKP_884356_46,-Renewal of Bhaghadeeha Bhitakalan to Mahuware Road,Chief Engineer Gorakhpur Zone PWD Gorakhpur UP||SE BASTI CIRCLE PWD BASTI||EE CONSTRUCTION DIVISION PWD BASTI,26-01-2024 05:43:25,Etenders UP NIC BOT,rejected,
2024_CEGKP_884748_18,Mahuava gram link road,Chief Engineer Gorakhpur Zone PWD Gorakhpur UP||SE DEORIA CIRCLE PWD DEORIA||EE CONSTRUCTION DIVISION PWD KUSHINAGAR,27-01-2024 06:51:11,Etenders UP NIC BOT,rejected,
2024_CEJNS_884464_18,Renewal work along with general repair of Inguwa ka Majra Chandelan Purwa Link Road in Km-1(450),Chief Engineer Jhansi Zone PWD Jhansi UP||CHITRAKOOT DHAAM MANDAL - BANDA CIRCLE PWD BANDA||PROVINCIAL DIVISION PWD BANDA,26-01-2024 05:41:52,Etenders UP NIC BOT,rejected,
2024_CEJNS_885520_3,Construction of Surikalan to Kuwangaun link road,Chief Engineer Jhansi Zone PWD Jhansi UP||JHANSI CIRLCE PWD JHANSI,26-01-2024 05:42:40,Etenders UP NIC BOT,rejected,
2024_CEJNS_885598_3,Samthar piprikalan to marodkalan Tigrakalan road,Chief Engineer Jhansi Zone PWD Jhansi UP||JHANSI CIRLCE PWD JHANSI||CONSTRUCTION DIVISION 3 PWD JHANSI,26-01-2024 05:15:51,Etenders UP NIC BOT,rejected,
2024_CEKNP_883622_3,"Renewal of Jhinjhak Kanchausi Road to Heeramansha via Langartha Road (ODR) (Km.1(500-1000), 2, 4, 5 and 8(500)",Cheif Engineer Kanpur Zone PWD Kanpur||SE KANPUR CIRCLE PWD KANPUR||EE PROVINCIAL DIVISION PWD KANPUR DEHAT,24-01-2024 05:18:39,Etenders UP NIC BOT,rejected,
2024_CEMBD_883738_7,Special repair of B B Road to Alawalpur Bundra Kalan Road in Distt Bijnor,Chief Engineer Moradabad Zone PWD Moradabad UP||RAMPUR CIRCLE PWD RAMPUR||PROVINCIAL DIVISION PWD BIJNOR,23-01-2024 05:16:25,Etenders UP NIC BOT,rejected,
2024_CEMRT_881412_1,Boundary wall work under special repair on the land of Public Works Department in Km 10 and 31 of Meerut Baraut Road.,Cheif Engineer Meerut Zone PWD Meerut||SE MEERUT CIRCLE PWD MEERUT||EE CONSTRUCTION DIVISION PWD MEERUT,22-01-2024 06:08:46,Etenders UP NIC BOT,rejected,
2024_CEMRT_882521_2,Special repair work of Fatehpur Kalan road from Behat Shakumbari Marg,Cheif Engineer Meerut Zone PWD Meerut||SE SAHARANPUR CIRCLE PWD SAHARANPUR,22-01-2024 09:13:31,Tendersodisha GOV BOT,rejected,
2024_CEMRT_882521_4,Special repair work of Dhaba to Landapul road at Km 9 of Gandevdi Hathnikund road,Cheif Engineer Meerut Zone PWD Meerut||SE SAHARANPUR CIRCLE PWD SAHARANPUR,20-01-2024 08:36:41,Tendersodisha GOV BOT,rejected,
2024_CEMRT_882616_6,Special repair work of Chutmalpur Roorkee road to Hasanpur Badkalan road.,Cheif Engineer Meerut Zone PWD Meerut||SE SAHARANPUR CIRCLE PWD SAHARANPUR,20-01-2024 05:17:14,Etenders UP NIC BOT,rejected,
2024_CEMRT_882949_7,New Construction work at Jewar Kanigarhi Bhagwantpur road to Chhatanga Kalan Mandir Road in District Gautambudhnagar,Cheif Engineer Meerut Zone PWD Meerut||SE BULAND SHAHAR PWD BULANDSHAHAR||EE PROVINCIAL DIVISION PWD GAUTAMBUDH NAGAR,21-01-2024 08:57:06,Tendersodisha GOV BOT,rejected,
2024_CEO_46064_1,"SUPPLY, INSTALLATION, TESTING AND COMMISSIONING OF OUTDOOR CCTV SURVEILLANCE SYSTEM AT MBB COLLEGE LAKE WITH INTEGRATION TO ICCC IN EPC MODE INCLUDING DLP OF THREE YEARS",Agartala Smart City Ltd. (Urban Development Dept)||CEO Agartala Smart City Ltd.(Urban Development Dept.),20-01-2024 08:50:27,TripuraTenders GOV NICGEP BOT,rejected,
2024_CEOUK_67178_1,e Tender for CCTV camera services for General Election 2024 in District Haridwar,Chief Electoral Officer Uttarakhand||Addl. Chief Electoral Officer||Dy. Chief Electoral Officer||Assistant District Election Officer Haridwar,04-01-2024 09:00:20,UKtenders GOV NICGEP BOT,rejected,Open
2024_CEOUK_67281_1,CCTV cameras at various places during the election process,Chief Electoral Officer Uttarakhand||Addl. Chief Electoral Officer||Dy. Chief Electoral Officer||Assistant District Election Officer Almora,11-01-2024 09:00:07,UKtenders GOV NICGEP BOT,approved,Not Submitted
2024_CEOUK_67422_1,Supply and Installation of CCTV Camara,Chief Electoral Officer Uttarakhand||Addl. Chief Electoral Officer||Dy. Chief Electoral Officer||Assistant District Election Officer Tehri Garhwal,10-01-2024 09:00:18,UKtenders GOV NICGEP BOT,rejected,Open
2024_CEOUK_67619_1,Supply and Installation of CCTV Camara at DEO Dehradun,Chief Electoral Officer Uttarakhand||Addl. Chief Electoral Officer||Dy. Chief Electoral Officer||Assistant District Election Officer Dehradun,13-01-2024 09:00:15,UKtenders GOV NICGEP BOT,rejected,Open
2024_CEPW_116286_1,JAL_PTK ROAD TO DERA BABA SARWAN DASS JI BALLAN ALONG CANAL TO MANNAN TO NAUGAJA TO KISHANGARH_KARTARPUR ROAD ODR_31 INCLUDING 5 YEARS MAINTENANCE 1 YEAR DLP _ 4 Yrs MAINT FOR REPAIR HEAD 5054 RB_10 MAINTENANCE 3054 FOR THE Yrs 2023_24,CE-PWD(B and R)||Construction Circle No.1-Jalandhar||Construction Division No.2-Jalandhar,24-01-2024 08:10:47,PBTenders GOV NICGEP BOT,rejected,
2024_CEPWD_378376_1,Construction of Teen Shed in the land under Gram Panchayat near Devri Dham (Iron Work),PWD - CE AND AS||ACE - JODHPUR||SE-JODHPUR||EE-DIST-I,20-01-2024 03:51:18,Eproc Rajasthan GOV BOT,rejected,
2024_CEPWD_378418_1,RCC Drain Work at Ch. 1/200 to 1/800 (Construction of 4 Lane Road Mata ka Than to Nagaur Road Via Anganwa Surpura Km 0/0 to 9/400),PWD - CE AND AS||ACE - JODHPUR||SE-JODHPUR||EE-CITY-JODHPUR,21-01-2024 03:50:25,Eproc Rajasthan GOV BOT,rejected,
2024_CEPWD_378418_2,RCC Drain Work at Ch. 1/800 to 2/100 (Construction of 4 Lane Road Mata ka Than to Nagaur Road Via Anganwa Surpura Km 0/0 to 9/400),PWD - CE AND AS||ACE - JODHPUR||SE-JODHPUR||EE-CITY-JODHPUR,22-01-2024 03:50:23,Eproc Rajasthan GOV BOT,rejected,
2024_CEUAZ_883899_1,Renewal of Langarpur Link Road,"Chief Engineer PWD Azamgarh Zone,Azamgarh||S.E. Azamgarh Circle,PWD,Azamgarh||Provincial Division, PWD, Azamgarh",26-01-2024 09:01:57,Tendersodisha GOV BOT,rejected,
2024_CEUCZ_882822_12,Renewal of Pangi Kalan Link Road,"Chief Engineer PWD Central Zone,Lucknow||S.E. UPPWD Sitapur||Construction Division-1, Khiri",20-01-2024 05:13:48,Etenders UP NIC BOT,rejected,
2024_CEUCZ_883128_1,Construction and 05 Year Maintenance of Matuwa Sakran Bholaganj Road (Sanda Sakran Road Km-3) Madhaipur to Sirsakalan via Bahraich Sitapur road (SH),"Chief Engineer PWD Central Zone,Lucknow||S.E. UPPWD Sitapur",24-01-2024 05:17:33,Etenders UP NIC BOT,rejected,
2024_CEUCZ_884225_6,Pure Shuklan link road,"Chief Engineer PWD Central Zone,Lucknow||S.E. UPPWD Lucknow||Provincial Division, Raebarelli",24-01-2024 05:14:41,Etenders UP NIC BOT,rejected,
2024_CEUVZ_882475_19,Special Repair of Pahadpur Belasi to Khankah Kalan Link Road,"Chief Engineer PWD Varanasi Zone||S.E. Jaunpur - Ghazipur Circle PWD Jaunpur||Construction Division - 1, PWD Ghazipur",24-01-2024 05:16:33,Etenders UP NIC BOT,rejected,
2024_CEUVZ_882475_6,Special Repair of Matakhanna to Dhanaipur via Khankah Kalan Link Road,"Chief Engineer PWD Varanasi Zone||S.E. Jaunpur - Ghazipur Circle PWD Jaunpur||Construction Division - 1, PWD Ghazipur",24-01-2024 08:45:44,Tendersodisha GOV BOT,rejected,
2024_CEUVZ_885575_1,Construction of Rajaswa gram Rajmilan me Danua se Mainahawa link road. (5 Years Anurakshan sahit),"Chief Engineer PWD Varanasi Zone||S.E. Sonebhadra Circle,PWD, Sonebhadra||Contruction Division,PWD ,Sonebhadra",26-01-2024 05:24:45,Etenders UP NIC BOT,rejected,
2024_CHD_78937_1,Strengthening of the damaged road Industrial Area Phase 3 Raipur Kalan Chandigarh,Chandigarh Administration||Engineering||Construction Circle - II||CP - II,26-01-2024 02:52:15,CHDTenders GOV NICGEP BOT,rejected,
2024_CHD_78960_1,"MAINTENANCE OF E.I IN NRB AT CHANDIGARH. (PROVIDING CCTV SURVEILLANCE SYSTEM AT ELECTION COUNTING CENTRE CCET SECTOR-26, CHANDIGARH UNDER THE JURSDICTION OF SDE E-5, CHANDIGARH.",Chandigarh Administration||Engineering||Electrical Circle||Electrical Div - I,26-01-2024 02:50:16,CHDTenders GOV NICGEP BOT,rejected,
2024_CMDAC_412059_1,"Development along Eastern side of Island Grounds with Modern Urban amenities such as Urban Plaza, Exhibition Pavilions, Landscaping, Open air Theatre, etc., at Chennai (Phase-I)",Chennai Metropolitan Development Authority||Construction Wing,24-01-2024 09:07:34,Tntenders GOV NIC BOT,rejected,
2024_CSIR_742727_1,(DP23-CU-12) 6.4MP non-cooled digital camera for microscope,Council of Scientific and Industrial Research||NISCPR-Delhi,23-01-2024 04:00:09,Eprocure Epublish BOT,rejected,
2024_DCFMD_13143_1,"LAN Set up (40 nodes) for e-office at DCF(MD) office, Chatham (Ground and First Floor)",Department of Environment and Forests||Office of DCF (Mill Division) Chatam,26-01-2024 02:01:39,AndamanTenders GOV NICGEP BOT,rejected,
2024_DCFMD_13150_1,"Supply, Installation, Testing and Commissioning of IP based CCTV Surveillance System at Mill Division, Chatham",Department of Environment and Forests||Office of DCF (Mill Division) Chatam,26-01-2024 02:00:29,AndamanTenders GOV NICGEP BOT,rejected,
2024_DCFMD_13158_1,"Loading, transportation and unloading of Industrial waste garbage etc. from Govt. Saw Mill, Chatham to designated PBMC landfill site(Brookshabad) including PBMC dumping charges, GST and other charges",Department of Environment and Forests||Office of DCF (Mill Division) Chatam,26-01-2024 02:02:25,AndamanTenders GOV NICGEP BOT,rejected,
2024_DEODD_81199_1,"Supply of Videography, Photography, CCTV and Various Materials",Cabinet Election Department||DEOGHAR ELECTION OFFICE,20-01-2024 06:10:29,JKDTenders GOV NICGEP BOT,rejected,
2024_DFWL_252544_1,MAINTENANCE OF PLANTATION OF 8110 FORESTRY PLANTS ON LAND AT DHULSIRAS,Department of Forests and Wildlife,26-01-2024 03:41:42,DelhiTenders GOV NICGEP BOT,rejected,
2024_DGPCS_324674_1,Maintenance and repairing of CCTV Camera All System at District Jail Shahdol,Director General of Prisons and Correctional Services||District Jail Shahdol,07-01-2024 07:30:08,Mptenders GOV BOT,approved,Not Submitted
2024_DHFW_116122_1,Biometric Machines and Web Cameras,Department of Health and Family Welfare||Punjab Health System Corporation||Medical Wing,20-01-2024 08:10:08,PBTenders GOV NICGEP BOT,rejected,
2024_DJB_252437_5,Replacement of old damaged water line to up gradation water distribution network under 300 mm dia for Ward No. 22E in AC-60 Krishna Nagar under ACE (M)-1.,Delhi Jal Board||Delhi Jal Board||EE (T-2) M-1,24-01-2024 03:42:49,DelhiTenders GOV NICGEP BOT,rejected,
2024_DLA_14805_1,Improvements to the lane adjacent to Uralkulam Street in Kirumampakkam in Embalam Constituency,Department of Local Administration||Bahour Commune Panchayat-DLA,23-01-2024 08:00:23,PuducherryTenders GOV NICGEP BOT,rejected,
2024_DLA_14859_1,Providing RCC slabs to the damaged portion of U drain running from Railway line to Uppar canal and improvements to cross Lanes at Rasu Udayar thottam in Uppalam Constituency,Department of Local Administration||Puducherry Municipality-DLA,20-01-2024 08:00:40,PuducherryTenders GOV NICGEP BOT,rejected,
2024_DLB_378381_5,"Wire Fencing work in Municipal Land, Properties in Municipal Area Tonk",DLB||Dy.DR-Ajmer||EO-Uniyara,20-01-2024 03:50:52,Eproc Rajasthan GOV BOT,rejected,
2024_DLG_114993_34,Installation of new CCTV Cameras on Various new Location at MC Rajpura,Department of Local Government||Director - Local Government||ADC (UD) - Patiala||Municipal Council - Rajpura,07-01-2024 08:10:35,PBTenders GOV NICGEP BOT,rejected,Open
2024_DLG_116027_1,GIS Based Mapping of Properties using Drone Images and Installation of Property UID Plates,Department of Local Government||Director - Local Government||Regional Deputy Director - Amritsar||Municipal Council - Dina Nagar,20-01-2024 08:29:22,PBTenders GOV NICGEP BOT,rejected,
2024_DLG_116099_1,Rough cost estimate for CCTV Survey of Main outfall storm water drainage system within jurisdiction of MC S.A.S Nagar.,Department of Local Government||Director - Local Government||Municipal Corporation - S.A.S Nagar,21-01-2024 08:10:42,PBTenders GOV NICGEP BOT,rejected,Open
2024_DLG_116151_2,Supply and fixing of 5 NO. LED street light set (30 watt) near residence 0f Manpreet Singh Son Of Manjit Singh at Lane No. 2 Punia Colony (Block Sangrur ),Department of Local Government||Director - Local Government||ADC (UD) - Sangrur||Municipal Council - Sangrur,23-01-2024 08:11:39,PBTenders GOV NICGEP BOT,rejected,
2024_DLG_116157_3,Construction of boundary wall fencing for the MC land in different area of city,Department of Local Government||Director - Local Government||ADC (UD) - Sangrur||Municipal Council - Sangrur,26-01-2024 08:19:34,PBTenders GOV NICGEP BOT,rejected,
